lix19937/dynamic_lix.log
[11/18/2024-12:08:59] [V] [TRT] *************** Autotuning format combination: Float((* 256 feature_number_0),feature_number_0,1) -> Float((* 256 feature_number_0),feature_number_0,1,1) where E0=(* 256 feature_number_0) ***************
[11/18/2024-12:08:59] [V] [TRT] --------------- Timing Runner: ONNXTRT_unsqueezeTensor (Shuffle[0x8000000d])
[11/18/2024-12:08:59] [V] [TRT] Tactic: 0x0000000000000000 Time: 0.0144969
[11/18/2024-12:08:59] [V] [TRT] Tactic: 0x0000000000000001 Time: 0.0291109
[11/18/2024-12:08:59] [V] [TRT] ONNXTRT_unsqueezeTensor (Shuffle[0x8000000d]) profiling completed in 0.0097675 seconds. Fastest Tactic: 0x0000000000000000 Time: 0.0144969
[11/18/2024-12:08:59] [V] [TRT] >>>>>>>>>>>>>>> Chose Runner Type: Shuffle Tactic: 0x0000000000000000
[11/18/2024-12:08:59] [V] [TRT] *************** Autotuning format combination: Float((* 256 feature_number_0),feature_number_0,1) -> Float((* 64 feature_number_0),1:4,64,64) ***************
[11/18/2024-12:08:59] [V] [TRT] --------------- Timing Runner: ONNXTRT_unsqueezeTensor (Shuffle[0x8000000d])
[11/18/2024-12:08:59] [V] [TRT] Tactic: 0x0000000000000000 Time: 0.0595962
[11/18/2024-12:08:59] [V] [TRT] ONNXTRT_unsqueezeTensor (Shuffle[0x8000000d]) profiling completed in 0.00447465 seconds. Fastest Tactic: 0x0000000000000000 Time: 0.0595962
[11/18/2024-12:08:59] [V] [TRT] >>>>>>>>>>>>>>> Chose Runner Type: Shuffle Tactic: 0x0000000000000000
[11/18/2024-12:08:59] [V] [TRT] *************** Autotuning format combination: Float(1,feature_number_0,1) -> Float((* 256 feature_number_0),1,256,256) ***************
[11/18/2024-12:08:59] [V] [TRT] --------------- Timing Runner: ONNXTRT_unsqueezeTensor (Shuffle[0x8000000d])
[11/18/2024-12:08:59] [V] [TRT] Tactic: 0x0000000000000000 Time: 0.059139
[11/18/2024-12:08:59] [V] [TRT] Tactic: 0x0000000000000001 Time: 0.0311086
[11/18/2024-12:08:59] [V] [TRT] ONNXTRT_unsqueezeTensor (Shuffle[0x8000000d]) profiling completed in 0.00374104 seconds. Fastest Tactic: 0x0000000000000001 Time: 0.0311086
[11/18/2024-12:08:59] [V] [TRT] >>>>>>>>>>>>>>> Chose Runner Type: Shuffle Tactic: 0x0000000000000001
[11/18/2024-12:08:59] [V] [TRT] *************** Autotuning format combination: Float(1:4,feature_number_0,1) -> Float((* 256 feature_number_0),feature_number_0,1,1) ***************
[11/18/2024-12:08:59] [V] [TRT] --------------- Timing Runner: ONNXTRT_unsqueezeTensor (Shuffle[0x8000000d])
[11/18/2024-12:08:59] [V] [TRT] Tactic: 0x0000000000000000 Time: 0.0319762
[11/18/2024-12:08:59] [V] [TRT] ONNXTRT_unsqueezeTensor (Shuffle[0x8000000d]) profiling completed in 0.00187588 seconds. Fastest Tactic: 0x0000000000000000 Time: 0.0319762
[11/18/2024-12:08:59] [V] [TRT] >>>>>>>>>>>>>>> Chose Runner Type: Shuffle Tactic: 0x0000000000000000
[11/18/2024-12:08:59] [V] [TRT] *************** Autotuning format combination: Float(1:4,feature_number_0,1) -> Float((* 64 feature_number_0),1:4,64,64) ***************
[11/18/2024-12:08:59] [V] [TRT] --------------- Timing Runner: ONNXTRT_unsqueezeTensor (Shuffle[0x8000000d])
[11/18/2024-12:08:59] [V] [TRT] Tactic: 0x0000000000000000 Time: 0.059584
[11/18/2024-12:08:59] [V] [TRT] Tactic: 0x0000000000000001 Time: 0.62379
[11/18/2024-12:08:59] [V] [TRT] ONNXTRT_unsqueezeTensor (Shuffle[0x8000000d]) profiling completed in 0.00822047 seconds. Fastest Tactic: 0x0000000000000000 Time: 0.059584
[11/18/2024-12:08:59] [V] [TRT] >>>>>>>>>>>>>>> Chose Runner Type: Shuffle Tactic: 0x0000000000000000
[11/18/2024-12:08:59] [V] [TRT] *************** Autotuning format combination: Float((* 256 feature_number_0):32,feature_number_0,1) -> Float((* 8 feature_number_0),feature_number_0:32,1,1) ***************
[11/18/2024-12:08:59] [V] [TRT] --------------- Timing Runner: ONNXTRT_unsqueezeTensor (Shuffle[0x8000000d])
[11/18/2024-12:08:59] [V] [TRT] Tactic: 0x0000000000000000 Time: 0.104901
[11/18/2024-12:08:59] [V] [TRT] Tactic: 0x0000000000000001 Time: 0.621714
[11/18/2024-12:08:59] [V] [TRT] ONNXTRT_unsqueezeTensor (Shuffle[0x8000000d]) profiling completed in 0.00896729 seconds. Fastest Tactic: 0x0000000000000000 Time: 0.104901
[11/18/2024-12:08:59] [V] [TRT] >>>>>>>>>>>>>>> Chose Runner Type: Shuffle Tactic: 0x0000000000000000
[11/18/2024-12:08:59] [V] [TRT] =============== Computing costs for ONNXTRT_unsqueezeTensor_42
[11/18/2024-12:08:59] [V] [TRT] ONNXTRT_unsqueezeTensor_42 [Float((* 256 feature_number_1),feature_number_1,1) -> Float((* 256 feature_number_1),feature_number_1,1,1) where E0=(* 256 feature_number_1)] got cached result: Shuffle, tactic 0x0000000000000000, 0 ms
[11/18/2024-12:08:59] [V] [TRT] ONNXTRT_unsqueezeTensor_42 [Float((* 256 feature_number_1),feature_number_1,1) -> Float((* 64 feature_number_1),1:4,64,64)] got cached result: Shuffle, tactic 0x0000000000000000, 0.0595962 ms
[11/18/2024-12:08:59] [V] [TRT] ONNXTRT_unsqueezeTensor_42 [Float(1,feature_number_1,1) -> Float((* 256 feature_number_1),1,256,256)] got cached result: Shuffle, tactic 0x0000000000000001, 0.0311086 ms
[11/18/2024-12:08:59] [V] [TRT] ONNXTRT_unsqueezeTensor_42 [Float(1:4,feature_number_1,1) -> Float((* 256 feature_number_1),feature_number_1,1,1)] got cached result: Shuffle, tactic 0x0000000000000000, 0.0319762 ms
[11/18/2024-12:08:59] [V] [TRT] ONNXTRT_unsqueezeTensor_42 [Float(1:4,feature_number_1,1) -> Float((* 64 feature_number_1),1:4,64,64)] got cached result: Shuffle, tactic 0x0000000000000000, 0.059584 ms
[11/18/2024-12:08:59] [V] [TRT] ONNXTRT_unsqueezeTensor_42 [Float((* 256 feature_number_1):32,feature_number_1,1) -> Float((* 8 feature_number_1),feature_number_1:32,1,1)] got cached result: Shuffle, tactic 0x0000000000000000, 0.104901 ms
[11/18/2024-12:08:59] [V] [TRT] =============== Computing costs for shuffle_between_ONNXTRT_unsqueezeTensor_42_output_and_/gnn/layers.0/attn/proj.1_1/Conv
[11/18/2024-12:08:59] [V] [TRT] *************** Autotuning format combination: Float((* 256 feature_number_1),feature_number_1,1,1) -> Float((* 256 feature_number_1),feature_number_1,feature_number_1,1) where E0=(* 256 feature_number_1) ***************
[11/18/2024-12:08:59] [V] [TRT] --------------- Timing Runner: shuffle_between_ONNXTRT_unsqueezeTensor_42_output_and_/gnn/layers.0/attn/proj.1_1/Conv (Shuffle[0x8000000d])
[11/18/2024-12:08:59] [V] [TRT] Tactic: 0x0000000000000000 Time: 0.0145303
[11/18/2024-12:08:59] [V] [TRT] Tactic: 0x0000000000000001 Time: 0.0292114
[11/18/2024-12:08:59] [V] [TRT] shuffle_between_ONNXTRT_unsqueezeTensor_42_output_and_/gnn/layers.0/attn/proj.1_1/Conv (Shuffle[0x8000000d]) profiling completed in 0.00335658 seconds. Fastest Tactic: 0x0000000000000000 Time: 0.0145303
[11/18/2024-12:08:59] [V] [TRT] >>>>>>>>>>>>>>> Chose Runner Type: Shuffle Tactic: 0x0000000000000000
[11/18/2024-12:08:59] [V] [TRT] *************** Autotuning format combination: Float((* 256 feature_number_1),feature_number_1,1,1) -> Float(E0,1:4,E0,64) where E0=(* 64 feature_number_1) where E0=(* 64 feature_number_1) ***************
[11/18/2024-12:08:59] [V] [TRT] --------------- Timing Runner: shuffle_between_ONNXTRT_unsqueezeTensor_42_output_and_/gnn/layers.0/attn/proj.1_1/Conv (Shuffle[0x8000000d])
[11/18/2024-12:08:59] [V] [TRT] Tactic: 0x0000000000000000 Time: 0.0282888
[11/18/2024-12:08:59] [V] [TRT] shuffle_between_ONNXTRT_unsqueezeTensor_42_output_and_/gnn/layers.0/attn/proj.1_1/Conv (Shuffle[0x8000000d]) profiling completed in 0.00164927 seconds. Fastest Tactic: 0x0000000000000000 Time: 0.0282888
[11/18/2024-12:08:59] [V] [TRT] >>>>>>>>>>>>>>> Chose Runner Type: Shuffle Tactic: 0x0000000000000000
[11/18/2024-12:08:59] [V] [TRT] *************** Autotuning format combination: Float((* 256 feature_number_1),1,256,256) -> Float(E0,1,E0,256) where E0=(* 256 feature_number_1) where E0=(* 256 feature_number_1) ***************
[11/18/2024-12:08:59] [V] [TRT] --------------- Timing Runner: shuffle_between_ONNXTRT_unsqueezeTensor_42_output_and_/gnn/layers.0/attn/proj.1_1/Conv (Shuffle[0x8000000d])
[11/18/2024-12:08:59] [V] [TRT] Tactic: 0x0000000000000000 Time: 0.0192297
[11/18/2024-12:08:59] [V] [TRT] Tactic: 0x0000000000000001 Time: 0.0344466
[11/18/2024-12:08:59] [V] [TRT] shuffle_between_ONNXTRT_unsqueezeTensor_42_output_and_/gnn/layers.0/attn/proj.1_1/Conv (Shuffle[0x8000000d]) profiling completed in 0.00332558 seconds. Fastest Tactic: 0x0000000000000000 Time: 0.0192297
[11/18/2024-12:08:59] [V] [TRT] >>>>>>>>>>>>>>> Chose Runner Type: Shuffle Tactic: 0x0000000000000000
[11/18/2024-12:08:59] [V] [TRT] *************** Autotuning format combination: Float((* 64 feature_number_1),1:4,64,64) -> Float((* 256 feature_number_1),feature_number_1,feature_number_1,1) ***************
[11/18/2024-12:08:59] [V] [TRT] --------------- Timing Runner: shuffle_between_ONNXTRT_unsqueezeTensor_42_output_and_/gnn/layers.0/attn/proj.1_1/Conv (Shuffle[0x8000000d])
[11/18/2024-12:08:59] [V] [TRT] Tactic: 0x0000000000000000 Time: 0.03376
[11/18/2024-12:08:59] [V] [TRT] shuffle_between_ONNXTRT_unsqueezeTensor_42_output_and_/gnn/layers.0/attn/proj.1_1/Conv (Shuffle[0x8000000d]) profiling completed in 0.0015714 seconds. Fastest Tactic: 0x0000000000000000 Time: 0.03376
[11/18/2024-12:08:59] [V] [TRT] >>>>>>>>>>>>>>> Chose Runner Type: Shuffle Tactic: 0x0000000000000000
[11/18/2024-12:08:59] [V] [TRT] *************** Autotuning format combination: Float((* 64 feature_number_1),1:4,64,64) -> Float(E0,1:4,E0,64) where E0=(* 64 feature_number_1) where E0=(* 64 feature_number_1) ***************
[11/18/2024-12:08:59] [V] [TRT] --------------- Timing Runner: shuffle_between_ONNXTRT_unsqueezeTensor_42_output_and_/gnn/layers.0/attn/proj.1_1/Conv (Shuffle[0x8000000d])
[11/18/2024-12:08:59] [V] [TRT] Tactic: 0x0000000000000000 Time: 0.0212983
[11/18/2024-12:08:59] [V] [TRT] Tactic: 0x0000000000000001 Time: 0.0345682
[11/18/2024-12:08:59] [V] [TRT] shuffle_between_ONNXTRT_unsqueezeTensor_42_output_and_/gnn/layers.0/attn/proj.1_1/Conv (Shuffle[0x8000000d]) profiling completed in 0.00322486 seconds. Fastest Tactic: 0x0000000000000000 Time: 0.0212983
[11/18/2024-12:08:59] [V] [TRT] >>>>>>>>>>>>>>> Chose Runner Type: Shuffle Tactic: 0x0000000000000000
[11/18/2024-12:08:59] [V] [TRT] *************** Autotuning format combination: Float((* 8 feature_number_1),feature_number_1:32,1,1) -> Float((* 8 feature_number_1),feature_number_1:32,feature_number_1,1) where E0=(* 8 feature_number_1) ***************
[11/18/2024-12:08:59] [V] [TRT] --------------- Timing Runner: shuffle_between_ONNXTRT_unsqueezeTensor_42_output_and_/gnn/layers.0/attn/proj.1_1/Conv (Shuffle[0x8000000d])
[11/18/2024-12:08:59] [V] [TRT] Tactic: 0x0000000000000000 Time: 0.0144946
[11/18/2024-12:08:59] [V] [TRT] Tactic: 0x0000000000000001 Time: 0.0344576
[11/18/2024-12:08:59] [V] [TRT] shuffle_between_ONNXTRT_unsqueezeTensor_42_output_and_/gnn/layers.0/attn/proj.1_1/Conv (Shuffle[0x8000000d]) profiling completed in 0.0032735 seconds. Fastest Tactic: 0x0000000000000000 Time: 0.0144946
[11/18/2024-12:08:59] [V] [TRT] >>>>>>>>>>>>>>> Chose Runner Type: Shuffle Tactic: 0x0000000000000000
[11/18/2024-12:08:59] [V] [TRT] =============== Computing costs for /gnn/layers.0/attn/proj.1_1/Conv || /gnn/layers.0/attn/proj.0_1/Conv
[11/18/2024-12:08:59] [V] [TRT] *************** Autotuning format combination: Float((* 256 feature_number_1),feature_number_1,feature_number_1,1) -> Float((* 512 feature_number_1),feature_number_1,feature_number_1,1) ***************
[11/18/2024-12:08:59] [V] [TRT] --------------- Timing Runner: /gnn/layers.0/attn/proj.1_1/Conv || /gnn/layers.0/attn/proj.0_1/Conv (CaskConvolution[0x80000009])
[11/18/2024-12:08:59] [V] [TRT] Tactic Name: volta_scudnn_128x64_relu_medium_nn_v1 Tactic: 0x90238daf8750ddb0 Time: 0.127109
[11/18/2024-12:08:59] [V] [TRT] Tactic Name: volta_scudnn_128x128_relu_medium_nn_v1 Tactic: 0x195431d38ba5af88 Time: 0.115415
[11/18/2024-12:08:59] [V] [TRT] Tactic Name: volta_scudnn_128x128_relu_small_nn_v1 Tactic: 0x365602d0613d4c36 Time: 0.114304
[11/18/2024-12:08:59] [V] [TRT] Tactic Name: volta_scudnn_128x32_relu_small_nn_v1 Tactic: 0xc939b7b0a4d5a05f Time: 0.141015
[11/18/2024-12:08:59] [V] [TRT] Tactic Name: volta_scudnn_128x32_relu_medium_nn_v1 Tactic: 0xc2a5fc6b5e7cef5e Time: 0.155346
[11/18/2024-12:08:59] [V] [TRT] Tactic Name: volta_scudnn_128x128_relu_interior_nn_v1 Tactic: 0x18597bd4a7d0164d Time: 0.113881
[11/18/2024-12:08:59] [V] [TRT] Tactic Name: sm50_xmma_conv_fprop_fused_conv_act_fp32_NCHW_fp32_NCHW_KCRS_fp32_fp32_fp32_Accfloat_1_1_cC1_dC1_srcVec2_fltVec1_1_TP3_TQ10_C1_R1_S1_U1_V1 Tactic: 0x053bede31607189f Time: 0.779529
[11/18/2024-12:08:59] [V] [TRT] Tactic Name: sm50_xmma_conv_fprop_fused_conv_act_fp32_NCHW_fp32_NCHW_KCRS_fp32_fp32_fp32_Accfloat_1_1_cC1_dC1_srcVec1_fltVec4_4_TP6_TQ5_C4_R1_S1_U1_V1 Tactic: 0x3652da2fa8bb0ef3 Time: 0.813943
[11/18/2024-12:08:59] [V] [TRT] Fast skip Tactic:0x79164861aa018d25 which exceed time limit during pre-run
[11/18/2024-12:08:59] [V] [TRT] Tactic Name: sm50_xmma_conv_fprop_fused_conv_act_fp32_NCHW_fp32_NCHW_KCRS_fp32_fp32_fp32_Accfloat_1_1_cC1_dC1_srcVec4_fltVec1_1_TP7_TQ4_C8_R1_S1_U1_V1 Tactic: 0x79164861aa018d25 Time: 1.8391
[11/18/2024-12:08:59] [V] [TRT] Fast skip Tactic:0x001526e231ae2e51 which exceed time limit during pre-run
[11/18/2024-12:08:59] [V] [TRT] Tactic Name: sm50_xmma_conv_fprop_fused_conv_act_fp32_NCHW_fp32_NCHW_KCRS_fp32_fp32_fp32_Accfloat_1_1_cC1_dC1_srcVec4_fltVec1_1_TP7_TQ2_C2_R1_S1_U1_V1 Tactic: 0x001526e231ae2e51 Time: 2.00819
[11/18/2024-12:09:00] [V] [TRT] Tactic Name: sm50_xmma_conv_fprop_fused_conv_act_fp32_NCHW_fp32_NCHW_KCRS_fp32_fp32_fp32_Accfloat_1_1_cC1_dC1_srcVec4_fltVec1_1_TP2_TQ7_C1_R1_S1_U1_V1 Tactic: 0xdfbf20bf5c5ed39e Time: 0.614002
[11/18/2024-12:09:00] [V] [TRT] Fast skip Tactic:0xadc24b6dce6a94cc which exceed time limit during pre-run
[11/18/2024-12:09:00] [V] [TRT] Tactic Name: sm50_xmma_conv_fprop_fused_conv_act_fp32_NCHW_fp32_NCHW_KCRS_fp32_fp32_fp32_Accfloat_1_1_cC1_dC1_srcVec4_fltVec1_1_TP4_TQ8_C8_R1_S1_U1_V1 Tactic: 0xadc24b6dce6a94cc Time: 1.05107
[11/18/2024-12:09:00] [V] [TRT] Fast skip Tactic:0x361add5e7e5ba900 which exceed time limit during pre-run
[11/18/2024-12:09:00] [V] [TRT] Tactic Name: sm50_xmma_conv_fprop_fused_conv_act_fp32_NCHW_fp32_NCHW_KCRS_fp32_fp32_fp32_Accfloat_1_1_cC1_dC1_srcVec2_fltVec2_2_TP7_TQ4_C4_R1_S1_U1_V1 Tactic: 0x361add5e7e5ba900 Time: 1.00688
[11/18/2024-12:09:00] [V] [TRT] Tactic Name: sm50_xmma_conv_fprop_fused_conv_act_fp32_NCHW_fp32_NCHW_KCRS_fp32_fp32_fp32_Accfloat_1_1_cC1_dC1_srcVec2_fltVec2_2_TP4_TQ4_C1_R1_S1_U1_V1 Tactic: 0x13e300b312a555d1 Time: 0.699771
[11/18/2024-12:09:00] [V] [TRT] Tactic Name: sm50_xmma_conv_fprop_fused_conv_act_fp32_NCHW_fp32_NCHW_KCRS_fp32_fp32_fp32_Accfloat_1_1_cC1_dC1_srcVec1_fltVec4_4_TP1_TQ10_C2_R1_S1_U1_V1 Tactic: 0x9140485476980e7c Time: 0.246843
[11/18/2024-12:09:00] [V] [TRT] Fast skip Tactic:0xba220b2881c61eb6 which exceed time limit during pre-run
[11/18/2024-12:09:00] [V] [TRT] Tactic Name: sm50_xmma_conv_fprop_fused_conv_act_fp32_NCHW_fp32_NCHW_KCRS_fp32_fp32_fp32_Accfloat_1_1_cC1_dC1_srcVec2_fltVec2_2_TP7_TQ2_C2_R1_S1_U1_V1 Tactic: 0xba220b2881c61eb6 Time: 1.16122
[11/18/2024-12:09:00] [V] [TRT] Fast skip Tactic:0xb1208f5cd1618214 which exceed time limit during pre-run
[11/18/2024-12:09:00] [V] [TRT] Tactic Name: sm50_xmma_conv_fprop_fused_conv_act_fp32_NCHW_fp32_NCHW_KCRS_fp32_fp32_fp32_Accfloat_1_1_cC1_dC1_srcVec4_fltVec1_1_TP8_TQ2_C2_R1_S1_U1_V1 Tactic: 0xb1208f5cd1618214 Time: 2.20208
[11/18/2024-12:09:00] [V] [TRT] Tactic Name: sm70_xmma_fprop_implicit_gemm_f32f32_f32f32_f32_nchwkcrs_nchw_tilesize128x16x8_stage1_warpsize4x1x1_g1_ffma_aligna4_alignc4 Tactic: 0x160b77f4a95ab6d3 Time: 0.239762
[11/18/2024-12:09:00] [V] [TRT] Tactic Name: sm50_xmma_conv_fprop_fused_conv_act_fp32_NCHW_fp32_NCHW_KCRS_fp32_fp32_fp32_Accfloat_1_1_cC1_dC1_srcVec2_fltVec2_2_TP2_TQ7_C4_R1_S1_U1_V1 Tactic: 0xeb3768a7d0a4636a Time: 0.39451
[11/18/2024-12:09:00] [V] [TRT] Tactic Name: sm50_xmma_conv_fprop_fused_conv_act_fp32_NCHW_fp32_NCHW_KCRS_fp32_fp32_fp32_Accfloat_1_1_cC1_dC1_srcVec2_fltVec1_1_TP3_TQ10_C4_R1_S1_U1_V1 Tactic: 0x8b8488312a95988c Time: 0.768283
[11/18/2024-12:09:00] [V] [TRT] Tactic Name: sm50_xmma_conv_fprop_fused_conv_act_fp32_NCHW_fp32_NCHW_KCRS_fp32_fp32_fp32_Accfloat_1_1_cC1_dC1_srcVec1_fltVec4_4_TP3_TQ8_C2_R1_S1_U1_V1 Tactic: 0xbc130e9bbb26c09e Time: 0.45787
[11/18/2024-12:09:00] [V] [TRT] Fast skip Tactic:0x46094dd94e60f58a which exceed time limit during pre-run
[11/18/2024-12:09:00] [V] [TRT] Tactic Name: sm50_xmma_conv_fprop_fused_conv_act_fp32_NCHW_fp32_NCHW_KCRS_fp32_fp32_fp32_Accfloat_1_1_cC1_dC1_srcVec4_fltVec1_1_TP7_TQ1_C1_R1_S1_U1_V1 Tactic: 0x46094dd94e60f58a Time: 2.61523
[11/18/2024-12:09:00] [V] [TRT] Fast skip Tactic:0x5df694d12c46ef44 which exceed time limit during pre-run
[11/18/2024-12:09:00] [V] [TRT] Tactic Name: sm50_xmma_conv_fprop_fused_conv_act_fp32_NCHW_fp32_NCHW_KCRS_fp32_fp32_fp32_Accfloat_1_1_cC1_dC1_srcVec4_fltVec1_1_TP4_TQ4_C2_R1_S1_U1_V1 Tactic: 0x5df694d12c46ef44 Time: 1.12435
[11/18/2024-12:09:00] [V] [TRT] Fast skip Tactic:0x95559a386f1ab48c which exceed time limit during pre-run
[11/18/2024-12:09:00] [V] [TRT] Tactic Name: sm50_xmma_conv_fprop_fused_conv_act_fp32_NCHW_fp32_NCHW_KCRS_fp32_fp32_fp32_Accfloat_1_1_cC1_dC1_srcVec4_fltVec1_1_TP4_TQ7_C4_R1_S1_U1_V1 Tactic: 0x95559a386f1ab48c Time: 1.0176
[11/18/2024-12:09:00] [V] [TRT] Fast skip Tactic:0x84b1c619b722ac50 which exceed time limit during pre-run
[11/18/2024-12:09:00] [V] [TRT] Tactic Name: sm50_xmma_conv_fprop_fused_conv_act_fp32_NCHW_fp32_NCHW_KCRS_fp32_fp32_fp32_Accfloat_1_1_cC1_dC1_srcVec2_fltVec2_2_TP8_TQ2_C8_R1_S1_U1_V1 Tactic: 0x84b1c619b722ac50 Time: 1.43846
[11/18/2024-12:09:00] [V] [TRT] Tactic Name: sm50_xmma_conv_fprop_fused_conv_act_fp32_NCHW_fp32_NCHW_KCRS_fp32_fp32_fp32_Accfloat_1_1_cC1_dC1_srcVec1_fltVec4_4_TP4_TQ5_C8_R1_S1_U1_V1 Tactic: 0x80a5d7e9c9c4b8ce Time: 0.487717
[11/18/2024-12:09:00] [V] [TRT] Tactic Name: sm50_xmma_conv_fprop_fused_conv_act_fp32_NCHW_fp32_NCHW_KCRS_fp32_fp32_fp32_Accfloat_1_1_cC1_dC1_srcVec2_fltVec2_2_TP2_TQ8_C4_R1_S1_U1_V1 Tactic: 0x269b010715e657e8 Time: 0.265051
[11/18/2024-12:09:00] [V] [TRT] Tactic Name: sm50_xmma_conv_fprop_fused_conv_act_fp32_NCHW_fp32_NCHW_KCRS_fp32_fp32_fp32_Accfloat_1_1_cC1_dC1_srcVec4_fltVec1_1_TP4_TQ8_C1_R1_S1_U1_V1 Tactic: 0xd646964a96ca001d Time: 0.705975
[11/18/2024-12:09:00] [V] [TRT] Tactic Name: sm50_xmma_conv_fprop_fused_conv_act_fp32_NCHW_fp32_NCHW_KCRS_fp32_fp32_fp32_Accfloat_1_1_cC1_dC1_srcVec4_fltVec1_1_TP4_TQ7_C8_R1_S1_U1_V1 Tactic: 0x606e22cd0b28a04e Time: 0.752955
[11/18/2024-12:09:00] [V] [TRT] Tactic Name: sm50_xmma_conv_fprop_fused_conv_act_fp32_NCHW_fp32_NCHW_KCRS_fp32_fp32_fp32_Accfloat_1_1_cC1_dC1_srcVec2_fltVec2_2_TP3_TQ10_C8_R1_S1_U1_V1 Tactic: 0x06122dede8a04ac8 Time: 0.372046
[11/18/2024-12:09:00] [V] [TRT] Tactic Name: sm50_xmma_conv_fprop_fused_conv_act_fp32_NCHW_fp32_NCHW_KCRS_fp32_fp32_fp32_Accfloat_1_1_cC1_dC1_srcVec4_fltVec1_1_TP5_TQ5_C2_R1_S1_U1_V1 Tactic: 0x55214d4ab35e0b9d Time: 0.888626
[11/18/2024-12:09:00] [V] [TRT] Tactic Name: sm50_xmma_conv_fprop_fused_conv_act_fp32_NCHW_fp32_NCHW_KCRS_fp32_fp32_fp32_Accfloat_1_1_cC1_dC1_srcVec2_fltVec2_2_TP2_TQ7_C2_R1_S1_U1_V1 Tactic: 0x91aab4dd62bd690b Time: 0.272105
[11/18/2024-12:09:00] [V] [TRT] Fast skip Tactic:0x8c2df094ce3399e7 which exceed time limit during pre-run
[11/18/2024-12:09:00] [V] [TRT] Tactic Name: sm50_xmma_conv_fprop_fused_conv_act_fp32_NCHW_fp32_NCHW_KCRS_fp32_fp32_fp32_Accfloat_1_1_cC1_dC1_srcVec4_fltVec1_1_TP7_TQ4_C4_R1_S1_U1_V1 Tactic: 0x8c2df094ce3399e7 Time: 1.2216
[11/18/2024-12:09:00] [V] [TRT] Tactic Name: sm50_xmma_conv_fprop_fused_conv_act_fp32_NCHW_fp32_NCHW_KCRS_fp32_fp32_fp32_Accfloat_1_1_cC1_dC1_srcVec2_fltVec2_2_TP4_TQ4_C2_R1_S1_U1_V1 Tactic: 0xe7c1b91b9c2edfa3 Time: 0.475991
[11/18/2024-12:09:00] [V] [TRT] Tactic Name: sm70_xmma_fprop_implicit_gemm_indexed_f32f32_f32f32_f32_nchwkcrs_nchw_tilesize128x16x8_stage1_warpsize4x1x1_g1_ffma_aligna4_alignc4 Tactic: 0x65d82d184f452332 Time: 0.205733
[11/18/2024-12:09:00] [V] [TRT] Tactic Name: sm50_xmma_conv_fprop_fused_conv_act_fp32_NCHW_fp32_NCHW_KCRS_fp32_fp32_fp32_Accfloat_1_1_cC1_dC1_srcVec2_fltVec2_2_TP3_TQ9_C8_R1_S1_U1_V1 Tactic: 0xdb776069eecca7f3 Time: 0.386441
[11/18/2024-12:09:00] [V] [TRT] Tactic Name: sm50_xmma_conv_fprop_fused_conv_act_fp32_NCHW_fp32_NCHW_KCRS_fp32_fp32_fp32_Accfloat_1_1_cC1_dC1_srcVec2_fltVec1_1_TP3_TQ10_C2_R1_S1_U1_V1 Tactic: 0xf119544b988c92ed Time: 0.541138
[11/18/2024-12:09:00] [V] [TRT] Tactic Name: sm50_xmma_conv_fprop_fused_conv_act_fp32_NCHW_fp32_NCHW_KCRS_fp32_fp32_fp32_Accfloat_1_1_cC1_dC1_srcVec2_fltVec2_2_TP4_TQ7_C4_R1_S1_U1_V1 Tactic: 0x2f62b7f2df72846b Time: 0.421522
[11/18/2024-12:09:00] [V] [TRT] Tactic Name: sm50_xmma_conv_fprop_fused_conv_act_fp32_NCHW_fp32_NCHW_KCRS_fp32_fp32_fp32_Accfloat_1_1_cC1_dC1_srcVec1_fltVec4_4_TP2_TQ7_C4_R1_S1_U1_V1 Tactic: 0xe3a8b64d995c2040 Time: 0.249755
[11/18/2024-12:09:00] [V] [TRT] Tactic Name: sm50_xmma_conv_fprop_fused_conv_act_fp32_NCHW_fp32_NCHW_KCRS_fp32_fp32_fp32_Accfloat_1_1_cC1_dC1_srcVec1_fltVec4_4_TP3_TQ7_C8_R1_S1_U1_V1 Tactic: 0xfe1903b4a84feabf Time: 0.370981
[11/18/2024-12:09:00] [V] [TRT] Tactic Name: sm50_xmma_conv_fprop_fused_conv_act_fp32_NCHW_fp32_NCHW_KCRS_fp32_fp32_fp32_Accfloat_1_1_cC1_dC1_srcVec4_fltVec1_1_TP5_TQ5_C4_R1_S1_U1_V1 Tactic: 0x2fbc9130014701fc Time: 0.9008
[11/18/2024-12:09:00] [V] [TRT] Tactic Name: volta_scudnn_128x64_relu_small_nn_v1 Tactic: 0x5e7d1125e7896624 Time: 0.0876549
[11/18/2024-12:09:00] [V] [TRT] Tactic Name: sm70_xmma_fprop_implicit_gemm_f32f32_f32f32_f32_nchwkcrs_nchw_tilesize128x256x8_stage1_warpsize2x4x1_g1_ffma_aligna4_alignc4 Tactic: 0xd2aa21bfe2167c0c Time: 0.100613
[11/18/2024-12:09:00] [V] [TRT] Tactic Name: sm50_xmma_conv_fprop_fused_conv_act_fp32_NCHW_fp32_NCHW_KCRS_fp32_fp32_fp32_Accfloat_1_1_cC1_dC1_srcVec4_fltVec1_1_TP1_TQ8_C2_R1_S1_U1_V1 Tactic: 0x4d77488847fb11ac Time: 0.273929
[11/18/2024-12:09:00] [V] [TRT] Tactic Name: sm50_xmma_conv_fprop_fused_conv_act_fp32_NCHW_fp32_NCHW_KCRS_fp32_fp32_fp32_Accfloat_1_1_cC1_dC1_srcVec4_fltVec1_1_TP4_TQ5_C2_R1_S1_U1_V1 Tactic: 0xbdab4046e67fd5a0 Time: 0.762149
[11/18/2024-12:09:00] [V] [TRT] Tactic Name: sm70_xmma_fprop_implicit_gemm_f32f32_f32f32_f32_nchwkcrs_nchw_tilesize64x64x8_stage1_warpsize1x4x1_g1_ffma_aligna4_alignc4 Tactic: 0xe40b38338a3a7d7e Time: 0.116507
[11/18/2024-12:09:00] [V] [TRT] Tactic Name: sm50_xmma_conv_fprop_fused_conv_act_fp32_NCHW_fp32_NCHW_KCRS_fp32_fp32_fp32_Accfloat_1_1_cC1_dC1_srcVec2_fltVec2_2_TP3_TQ10_C2_R1_S1_U1_V1 Tactic: 0x89b449623e8b546b Time: 0.332649
[11/18/2024-12:09:00] [V] [TRT] Tactic Name: sm70_xmma_fprop_implicit_gemm_f32f32_f32f32_f32_nchwkcrs_nchw_tilesize64x128x8_stage1_warpsize1x4x1_g1_ffma_aligna4_alignc4 Tactic: 0xd1338f4b38d341e2 Time: 0.0990491
[11/18/2024-12:09:00] [V] [TRT] Tactic Name: sm50_xmma_conv_fprop_fused_conv_act_fp32_NCHW_fp32_NCHW_KCRS_fp32_fp32_fp32_Accfloat_1_1_cC1_dC1_srcVec2_fltVec2_2_TP2_TQ9_C1_R1_S1_U1_V1 Tactic: 0x4879b042e34ded1f Time: 0.280105
[11/18/2024-12:09:00] [V] [TRT] Tactic Name: sm50_xmma_conv_fprop_fused_conv_act_fp32_NCHW_fp32_NCHW_KCRS_fp32_fp32_fp32_Accfloat_1_1_cC1_dC1_srcVec2_fltVec1_1_TP4_TQ8_C8_R1_S1_U1_V1 Tactic: 0x4f9a95a9a8862c25 Time: 0.731858
[11/18/2024-12:09:00] [V] [TRT] Tactic Name: sm50_xmma_conv_fprop_fused_conv_act_fp32_NCHW_fp32_NCHW_KCRS_fp32_fp32_fp32_Accfloat_1_1_cC1_dC1_srcVec2_fltVec2_2_TP5_TQ5_C1_R1_S1_U1_V1 Tactic: 0x1b34d9288dbdb108 Time: 0.535049
[11/18/2024-12:09:00] [V] [TRT] Tactic Name: sm70_xmma_fprop_implicit_gemm_f32f32_f32f32_f32_nchwkcrs_nchw_tilesize128x128x8_stage1_warpsize2x2x1_g1_ffma_aligna4_alignc4 Tactic: 0xac49795b871b0d29 Time: 0.0971611
[11/18/2024-12:09:00] [V] [TRT] Tactic Name: sm70_xmma_fprop_implicit_gemm_f32f32_f32f32_f32_nchwkcrs_nchw_tilesize128x64x8_stage1_warpsize2x2x1_g1_ffma_aligna4_alignc4 Tactic: 0x994f5b723e2d80da Time: 0.101264
[11/18/2024-12:09:00] [V] [TRT] Tactic Name: sm70_xmma_fprop_implicit_gemm_indexed_f32f32_f32f32_f32_nchwkcrs_nchw_tilesize128x32x8_stage1_warpsize2x2x1_g1_ffma_aligna4_alignc4 Tactic: 0x8c4f6360145d6a1f Time: 0.142857
[11/18/2024-12:09:00] [V] [TRT] Tactic Name: sm70_xmma_fprop_implicit_gemm_f32f32_f32f32_f32_nchwkcrs_nchw_tilesize64x64x8_stage1_warpsize1x4x1_g1_ffma_t1r1s1_aligna4_alignc4 Tactic: 0xa3cd285aae791bdd Time: 0.114418
[11/18/2024-12:09:00] [V] [TRT] Tactic Name: sm50_xmma_conv_fprop_fused_conv_act_fp32_NCHW_fp32_NCHW_KCRS_fp32_fp32_fp32_Accfloat_1_1_cC1_dC1_srcVec4_fltVec1_1_TP1_TQ7_C1_R1_S1_U1_V1 Tactic: 0x74f998800c32af5c Time: 0.298715
[11/18/2024-12:09:00] [V] [TRT] Tactic Name: sm50_xmma_conv_fprop_fused_conv_act_fp32_NCHW_fp32_NCHW_KCRS_fp32_fp32_fp32_Accfloat_1_1_cC1_dC1_srcVec1_fltVec4_4_TP3_TQ7_C4_R1_S1_U1_V1 Tactic: 0x0b22bb41cc7dfe7d Time: 0.324978
[11/18/2024-12:09:00] [V] [TRT] Tactic Name: sm70_xmma_fprop_implicit_gemm_indexed_f32f32_f32f32_f32_nchwkcrs_nchw_tilesize64x64x8_stage1_warpsize1x4x1_g1_ffma_aligna4_alignc4 Tactic: 0x8d5c64a52fab02c9 Time: 0.125033
[11/18/2024-12:09:00] [V] [TRT] Tactic Name: sm50_xmma_conv_fprop_fused_conv_act_fp32_NCHW_fp32_NCHW_KCRS_fp32_fp32_fp32_Accfloat_1_1_cC1_dC1_srcVec4_fltVec1_1_TP2_TQ7_C2_R1_S1_U1_V1 Tactic: 0x2b9d9917d2d559ec Time: 0.426075
[11/18/2024-12:09:00] [V] [TRT] Tactic Name: sm50_xmma_conv_fprop_fused_conv_act_fp32_NCHW_fp32_NCHW_KCRS_fp32_fp32_fp32_Accfloat_1_1_cC1_dC1_srcVec2_fltVec2_2_TP7_TQ2_C4_R1_S1_U1_V1 Tactic: 0xc0bfd75233df14d7 Time: 0.871973
[11/18/2024-12:09:00] [V] [TRT] Tactic Name: volta_scudnn_128x32_relu_interior_nn_v1 Tactic: 0x25eed4cfa195d49d Time: 0.097424
[11/18/2024-12:09:00] [V] [TRT] Tactic Name: volta_scudnn_128x64_relu_interior_nn_v1 Tactic: 0x7e29bdfccd92c42c Time: 0.0839566
[11/18/2024-12:09:00] [V] [TRT] Tactic Name: sm70_xmma_fprop_implicit_gemm_f32f32_f32f32_f32_nchwkcrs_nchw_tilesize128x32x8_stage1_warpsize2x2x1_g1_ffma_simple_t1r1s1_aligna4_alignc4 Tactic: 0xbe8434a96b14e8b2 Time: 0.120473
[11/18/2024-12:09:00] [V] [TRT] Tactic Name: sm70_xmma_fprop_implicit_gemm_f32f32_f32f32_f32_nchwkcrs_nchw_tilesize64x64x8_stage1_warpsize1x4x1_g1_ffma_simple_t1r1s1_aligna4_alignc4 Tactic: 0x5193693bc0732c65 Time: 0.117646
[11/18/2024-12:09:00] [V] [TRT] Tactic Name: sm50_xmma_conv_fprop_fused_conv_act_fp32_NCHW_fp32_NCHW_KCRS_fp32_fp32_fp32_Accfloat_1_1_cC1_dC1_srcVec4_fltVec1_1_TP2_TQ7_C4_R1_S1_U1_V1 Tactic: 0x5100456d60cc538d Time: 0.442939
[11/18/2024-12:09:00] [V] [TRT] Tactic Name: sm50_xmma_conv_fprop_fused_conv_act_fp32_NCHW_fp32_NCHW_KCRS_fp32_fp32_fp32_Accfloat_1_1_cC1_dC1_srcVec4_fltVec1_1_TP3_TQ9_C4_R1_S1_U1_V1 Tactic: 0x947bf5563a9683d6 Time: 0.563785
[11/18/2024-12:09:00] [V] [TRT] Tactic Name: sm50_xmma_conv_fprop_fused_conv_act_fp32_NCHW_fp32_NCHW_KCRS_fp32_fp32_fp32_Accfloat_1_1_cC1_dC1_srcVec2_fltVec2_2_TP2_TQ9_C4_R1_S1_U1_V1 Tactic: 0xc6c6d590dfdf6d0c Time: 0.262043
[11/18/2024-12:09:00] [V] [TRT] Tactic Name: sm50_xmma_conv_fprop_fused_conv_act_fp32_NCHW_fp32_NCHW_KCRS_fp32_fp32_fp32_Accfloat_1_1_cC1_dC1_srcVec2_fltVec2_2_TP2_TQ7_C1_R1_S1_U1_V1 Tactic: 0x65880d75ec36e379 Time: 0.316622
[11/18/2024-12:09:00] [V] [TRT] Tactic Name: sm70_xmma_fprop_implicit_gemm_f32f32_f32f32_f32_nchwkcrs_nchw_tilesize64x128x8_stage1_warpsize1x4x1_g1_ffma_simple_t1r1s1_aligna4_alignc4 Tactic: 0xa0dcf7c2b333d150 Time: 0.103531
[11/18/2024-12:09:00] [V] [TRT] Tactic Name: sm50_xmma_conv_fprop_fused_conv_act_fp32_NCHW_fp32_NCHW_KCRS_fp32_fp32_fp32_Accfloat_1_1_cC1_dC1_srcVec2_fltVec2_2_TP1_TQ7_C1_R1_S1_U1_V1 Tactic: 0xceceb54abc5a9fbb Time: 0.289591
[11/18/2024-12:09:00] [V] [TRT] Fast skip Tactic:0x588a737570bcf22b which exceed time limit during pre-run
[11/18/2024-12:09:00] [V] [TRT] Tactic Name: sm50_xmma_conv_fprop_fused_conv_act_fp32_NCHW_fp32_NCHW_KCRS_fp32_fp32_fp32_Accfloat_1_1_cC1_dC1_srcVec1_fltVec1_1_TP7_TQ4_C1_R1_S1_U1_V1 Tactic: 0x588a737570bcf22b Time: 1.32797
[11/18/2024-12:09:00] [V] [TRT] Tactic Name: sm50_xmma_conv_fprop_fused_conv_act_fp32_NCHW_fp32_NCHW_KCRS_fp32_fp32_fp32_Accfloat_1_1_cC1_dC1_srcVec1_fltVec4_4_TP3_TQ10_C4_R1_S1_U1_V1 Tactic: 0x0b33f9e893e376e6 Time: 0.33776
[11/18/2024-12:09:00] [V] [TRT] Tactic Name: sm50_xmma_conv_fprop_fused_conv_act_fp32_NCHW_fp32_NCHW_KCRS_fp32_fp32_fp32_Accfloat_1_1_cC1_dC1_srcVec2_fltVec2_2_TP4_TQ7_C8_R1_S1_U1_V1 Tactic: 0xda590f07bb4090a9 Time: 0.512256
[11/18/2024-12:09:00] [V] [TRT] Tactic Name: sm50_xmma_conv_fprop_fused_conv_act_fp32_NCHW_fp32_NCHW_KCRS_fp32_fp32_fp32_Accfloat_1_1_cC1_dC1_srcVec2_fltVec2_2_TP7_TQ4_C8_R1_S1_U1_V1 Tactic: 0xc32165ab1a69bdc2 Time: 0.853975
[11/18/2024-12:09:00] [V] [TRT] Tactic Name: sm50_xmma_conv_fprop_fused_conv_act_fp32_NCHW_fp32_NCHW_KCRS_fp32_fp32_fp32_Accfloat_1_1_cC1_dC1_srcVec2_fltVec2_2_TP2_TQ8_C2_R1_S1_U1_V1 Tactic: 0x5c06dd7da7ff5d89 Time: 0.275602
[11/18/2024-12:09:00] [V] [TRT] Tactic Name: sm50_xmma_conv_fprop_fused_conv_act_fp32_NCHW_fp32_NCHW_KCRS_fp32_fp32_fp32_Accfloat_1_1_cC1_dC1_srcVec2_fltVec2_2_TP2_TQ8_C8_R1_S1_U1_V1 Tactic: 0xd3a0b9f271d4432a Time: 0.296667
[11/18/2024-12:09:00] [V] [TRT] Tactic Name: sm50_xmma_conv_fprop_fused_conv_act_fp32_NCHW_fp32_NCHW_KCRS_fp32_fp32_fp32_Accfloat_1_1_cC1_dC1_srcVec1_fltVec1_1_TP3_TQ10_C8_R1_S1_U1_V1 Tactic: 0x77ff66671dd929ae Time: 0.586665
[11/18/2024-12:09:00] [V] [TRT] Tactic Name: sm50_xmma_conv_fprop_fused_conv_act_fp32_NCHW_fp32_NCHW_KCRS_fp32_fp32_fp32_Accfloat_1_1_cC1_dC1_srcVec1_fltVec4_4_TP6_TQ5_C2_R1_S1_U1_V1 Tactic: 0x4ccf06551aa20492 Time: 0.634839
[11/18/2024-12:09:00] [V] [TRT] Tactic Name: sm50_xmma_conv_fprop_fused_conv_act_fp32_NCHW_fp32_NCHW_KCRS_fp32_fp32_fp32_Accfloat_1_1_cC1_dC1_srcVec2_fltVec2_2_TP2_TQ10_C1_R1_S1_U1_V1 Tactic: 0xc48d91bc4c36e826 Time: 0.286363
[11/18/2024-12:09:00] [V] [TRT] Tactic Name: sm50_xmma_conv_fprop_fused_conv_act_fp32_NCHW_fp32_NCHW_KCRS_fp32_fp32_fp32_Accfloat_1_1_cC1_dC1_srcVec2_fltVec2_2_TP2_TQ9_C2_R1_S1_U1_V1 Tactic: 0xbc5b09ea6dc6676d Time: 0.263301
[11/18/2024-12:09:00] [V] [TRT] Tactic Name: sm50_xmma_conv_fprop_fused_conv_act_fp32_NCHW_fp32_NCHW_KCRS_fp32_fp32_fp32_Accfloat_1_1_cC1_dC1_srcVec1_fltVec4_4_TP5_TQ5_C1_R1_S1_U1_V1 Tactic: 0x13ab07c2c445f222 Time: 0.525426
[11/18/2024-12:09:00] [V] [TRT] Tactic Name: sm50_xmma_conv_fprop_fused_conv_act_fp32_NCHW_fp32_NCHW_KCRS_fp32_fp32_fp32_Accfloat_1_1_cC1_dC1_srcVec2_fltVec2_2_TP3_TQ8_C1_R1_S1_U1_V1 Tactic: 0x40ae69d97c5509c6 Time: 0.362711
[11/18/2024-12:09:00] [V] [TRT] Tactic Name: sm50_xmma_conv_fprop_fused_conv_act_fp32_NCHW_fp32_NCHW_KCRS_fp32_fp32_fp32_Accfloat_1_1_cC1_dC1_srcVec4_fltVec1_1_TP4_TQ7_C2_R1_S1_U1_V1 Tactic: 0xefc84642dd03beed Time: 0.732306
[11/18/2024-12:09:00] [V] [TRT] Tactic Name: sm50_xmma_conv_fprop_fused_conv_act_fp32_NCHW_fp32_NCHW_KCRS_fp32_fp32_fp32_Accfloat_1_1_cC1_dC1_srcVec2_fltVec2_2_TP4_TQ4_C8_R1_S1_U1_V1 Tactic: 0x6867dd944a05c100 Time: 0.535735
[11/18/2024-12:09:00] [V] [TRT] Tactic Name: sm50_xmma_conv_fprop_fused_conv_act_fp32_NCHW_fp32_NCHW_KCRS_fp32_fp32_fp32_Accfloat_1_1_cC1_dC1_srcVec1_fltVec4_4_TP4_TQ7_C4_R1_S1_U1_V1 Tactic: 0x27fd6918968ac741 Time: 0.425463
[11/18/2024-12:09:00] [V] [TRT] Tactic Name: sm50_xmma_conv_fprop_fused_conv_act_fp32_NCHW_fp32_NCHW_KCRS_fp32_fp32_fp32_Accfloat_1_1_cC1_dC1_srcVec1_fltVec2_2_TP3_TQ7_C8_R1_S1_U1_V1 Tactic: 0x4ec6e5a90546faa3 Time: 0.426839
[11/18/2024-12:09:00] [V] [TRT] Tactic Name: sm50_xmma_conv_fprop_fused_conv_act_fp32_NCHW_fp32_NCHW_KCRS_fp32_fp32_fp32_Accfloat_1_1_cC1_dC1_srcVec4_fltVec1_1_TP2_TQ8_C2_R1_S1_U1_V1 Tactic: 0xe631f0b717976d6e Time: 0.420622
[11/18/2024-12:09:00] [V] [TRT] /gnn/layers.0/attn/proj.1_1/Conv || /gnn/layers.0/attn/proj.0_1/Conv (CaskConvolution[0x80000009]) profiling completed in 0.469895 seconds. Fastest Tactic: 0x7e29bdfccd92c42c Time: 0.0839566
[11/18/2024-12:09:00] [V] [TRT] Skipping CaskFlattenConvolution: No valid tactics for /gnn/layers.0/attn/proj.1_1/Conv || /gnn/layers.0/attn/proj.0_1/Conv
[11/18/2024-12:09:00] [V] [TRT] >>>>>>>>>>>>>>> Chose Runner Type: CaskConvolution Tactic: 0x7e29bdfccd92c42c
[11/18/2024-12:09:00] [V] [TRT] *************** Autotuning format combination: Float(E0,1,E0,256) where E0=(* 256 feature_number_1) -> Float(E0,1,E0,512) where E0=(* 512 feature_number_1) where E0=(* 256 feature_number_1) E1=(* 512 feature_number_1) ***************
[11/18/2024-12:09:00] [V] [TRT] --------------- Timing Runner: /gnn/layers.0/attn/proj.1_1/Conv || /gnn/layers.0/attn/proj.0_1/Conv (CaskConvolution[0x80000009])
[11/18/2024-12:09:00] [V] [TRT] Tactic Name: sm70_xmma_fprop_implicit_gemm_indexed_f32f32_f32f32_f32_nhwckrsc_nhwc_tilesize128x16x8_stage1_warpsize4x1x1_g1_ffma_aligna4_alignc4 Tactic: 0x6aaac747558eb868 Time: 0.250999
[11/18/2024-12:09:00] [V] [TRT] Tactic Name: sm70_xmma_fprop_implicit_gemm_f32f32_f32f32_f32_nhwckrsc_nhwc_tilesize64x16x16_stage1_warpsize1x1x1_g1_ffma_simple_t1r1s1_aligna4_alignc4 Tactic: 0x53056a2984bcd5bc Time: 0.174121
[11/18/2024-12:09:00] [V] [TRT] Tactic Name: sm70_xmma_fprop_implicit_gemm_f32f32_f32f32_f32_nhwckrsc_nhwc_tilesize128x64x8_stage1_warpsize2x2x1_g1_ffma_simple_t1r1s1_aligna4_alignc4 Tactic: 0xe957dcfcec24ec5d Time: 0.109861
[11/18/2024-12:09:00] [V] [TRT] Tactic Name: sm70_xmma_fprop_implicit_gemm_f32f32_f32f32_f32_nhwckrsc_nhwc_tilesize64x128x8_stage1_warpsize1x4x1_g1_ffma_simple_t1r1s1_aligna4_alignc4 Tactic: 0xfbba95cf52891795 Time: 0.109765
[11/18/2024-12:09:00] [V] [TRT] Tactic Name: sm70_xmma_fprop_implicit_gemm_f32f32_f32f32_f32_nhwckrsc_nhwc_tilesize128x64x8_stage1_warpsize2x2x1_g1_ffma_aligna4_alignc4 Tactic: 0x963db12d24e61b80 Time: 0.11488
[11/18/2024-12:09:00] [V] [TRT] Tactic Name: sm70_xmma_fprop_implicit_gemm_f32f32_f32f32_f32_nhwckrsc_nhwc_tilesize64x16x16_stage1_warpsize1x1x1_g1_ffma_aligna4_alignc4 Tactic: 0x3f904b355d9ca8e6 Time: 0.19152
[11/18/2024-12:09:00] [V] [TRT] Tactic Name: sm70_xmma_fprop_implicit_gemm_f32f32_f32f32_f32_nhwckrsc_nhwc_tilesize128x32x8_stage1_warpsize2x2x1_g1_ffma_simple_t1r1s1_aligna4_alignc4 Tactic: 0xe5e256a48aae2e77 Time: 0.133301
[11/18/2024-12:09:00] [V] [TRT] Tactic Name: sm70_xmma_fprop_implicit_gemm_f32f32_f32f32_f32_nhwckrsc_nhwc_tilesize64x64x8_stage1_warpsize1x4x1_g1_ffma_aligna4_alignc4 Tactic: 0x2595402367cdee5c Time: 0.123698
[11/18/2024-12:09:00] [V] [TRT] Tactic Name: sm70_xmma_fprop_implicit_gemm_f32f32_f32f32_f32_nhwckrsc_nhwc_tilesize256x128x8_stage1_warpsize2x4x1_g1_ffma_aligna4_alignc4 Tactic: 0x0447933cc2be855a Time: 0.106457
[11/18/2024-12:09:00] [V] [TRT] Tactic Name: sm70_xmma_fprop_implicit_gemm_f32f32_f32f32_f32_nhwckrsc_nhwc_tilesize64x64x8_stage1_warpsize1x4x1_g1_ffma_simple_t1r1s1_aligna4_alignc4 Tactic: 0xded29d328f8f7228 Time: 0.123522
[11/18/2024-12:09:00] [V] [TRT] Tactic Name: sm70_xmma_fprop_implicit_gemm_f32f32_f32f32_f32_nhwckrsc_nhwc_tilesize64x128x8_stage1_warpsize1x4x1_g1_ffma_t1r1s1_aligna4_alignc4 Tactic: 0xa79cf41de521f476 Time: 0.11261
[11/18/2024-12:09:00] [V] [TRT] Tactic Name: sm70_xmma_fprop_implicit_gemm_f32f32_f32f32_f32_nhwckrsc_nhwc_tilesize64x32x32_stage1_warpsize1x1x1_g1_ffma_simple_t1r1s1_aligna4_alignc4 Tactic: 0xa1ca175f00ddac25 Time: 0.567584
[11/18/2024-12:09:00] [V] [TRT] Tactic Name: sm70_xmma_fprop_implicit_gemm_indexed_f32f32_f32f32_f32_nhwckrsc_nhwc_tilesize128x32x8_stage1_warpsize2x2x1_g1_ffma_aligna4_alignc4 Tactic: 0x833d893f0e96f145 Time: 0.152064
[11/18/2024-12:09:00] [V] [TRT] Tactic Name: sm70_xmma_fprop_implicit_gemm_f32f32_f32f32_f32_nhwckrsc_nhwc_tilesize128x16x8_stage1_warpsize4x1x1_g1_ffma_aligna4_alignc4 Tactic: 0x19799dabb3912d89 Time: 0.217088
[11/18/2024-12:09:00] [V] [TRT] Tactic Name: sm70_xmma_fprop_implicit_gemm_f32f32_f32f32_f32_nhwckrsc_nhwc_tilesize64x32x32_stage1_warpsize1x1x1_g1_ffma_aligna4_alignc4 Tactic: 0xdb73e25ae4006f74 Time: 0.88971
[11/18/2024-12:09:00] [V] [TRT] Tactic Name: sm70_xmma_fprop_implicit_gemm_f32f32_f32f32_f32_nhwckrsc_nhwc_tilesize64x128x8_stage1_warpsize1x4x1_g1_ffma_aligna4_alignc4 Tactic: 0xde4165142218dab8 Time: 0.114016
[11/18/2024-12:09:00] [V] [TRT] Tactic Name: sm70_xmma_fprop_implicit_gemm_f32f32_f32f32_f32_nhwckrsc_nhwc_tilesize64x64x8_stage1_warpsize1x4x1_g1_ffma_t1r1s1_aligna4_alignc4 Tactic: 0x704db0897ce9340d Time: 0.123534
[11/18/2024-12:09:00] [V] [TRT] /gnn/layers.0/attn/proj.1_1/Conv || /gnn/layers.0/attn/proj.0_1/Conv (CaskConvolution[0x80000009]) profiling completed in 0.0634071 seconds. Fastest Tactic: 0x0447933cc2be855a Time: 0.106457
[11/18/2024-12:09:00] [V] [TRT] /gnn/layers.0/attn/proj.1_1/Conv || /gnn/layers.0/attn/proj.0_1/Conv: 116 available tactics, 0 unparsable, 58 pruned, 58 remaining after tactic pruning.
[11/18/2024-12:09:00] [V] [TRT] --------------- Timing Runner: /gnn/layers.0/attn/proj.1_1/Conv || /gnn/layers.0/attn/proj.0_1/Conv (CaskGemmConvolution[0x8000002e])
[11/18/2024-12:09:00] [V] [TRT] Tactic Name: volta_sgemm_64x64_tn_v1 numSplitK: 1 numBuffers: 0 numKernels: 1 Tactic: 0x0000000000020477 Time: 0.128656
[11/18/2024-12:09:00] [V] [TRT] Tactic Name: turing_sgemm_64x64_nn_v1 numSplitK: 1 numBuffers: 0 numKernels: 1 Tactic: 0x00000000000200b2 Time: 0.121643
[11/18/2024-12:09:00] [V] [TRT] Tactic Name: turing_sgemm_64x64_relu_nn_v1 numSplitK: 1 numBuffers: 0 numKernels: 1 Tactic: 0x0000000000020130 Time: 0.096208
[11/18/2024-12:09:00] [V] [TRT] Tactic Name: volta_sgemm_64x64_relu_nn_v1 numSplitK: 1 numBuffers: 0 numKernels: 1 Tactic: 0x0000000000020031 Time: 0.0958994
[11/18/2024-12:09:00] [V] [TRT] Tactic Name: volta_sgemm_64x64_nn_v1 numSplitK: 1 numBuffers: 0 numKernels: 1 Tactic: 0x0000000000020482 Time: 0.120622
[11/18/2024-12:09:00] [V] [TRT] Tactic Name: turing_sgemm_64x64_tn_v1 numSplitK: 1 numBuffers: 0 numKernels: 1 Tactic: 0x0000000000020188 Time: 0.127259
[11/18/2024-12:09:00] [V] [TRT] Tactic Name: turing_sgemm_64x64_relu_tn_v1 numSplitK: 1 numBuffers: 0 numKernels: 1 Tactic: 0x0000000000020244 Time: 0.102985
[11/18/2024-12:09:00] [V] [TRT] Tactic Name: volta_sgemm_64x64_relu_tn_v1 numSplitK: 1 numBuffers: 0 numKernels: 1 Tactic: 0x00000000000200a8 Time: 0.106681
[11/18/2024-12:09:00] [V] [TRT] Tactic Name: volta_sgemm_128x64_relu_nn_v1 numSplitK: 1 numBuffers: 0 numKernels: 1 Tactic: 0x0000000000020111 Time: 0.0786331
[11/18/2024-12:09:00] [V] [TRT] Tactic Name: volta_sgemm_128x64_nn_v1 numSplitK: 1 numBuffers: 0 numKernels: 1 Tactic: 0x00000000000201fc Time: 0.104576
[11/18/2024-12:09:00] [V] [TRT] Tactic Name: volta_sgemm_128x64_tn_v1 numSplitK: 1 numBuffers: 0 numKernels: 1 Tactic: 0x0000000000020040 Time: 0.110398
[11/18/2024-12:09:00] [V] [TRT] Tactic Name: turing_sgemm_128x64_nn_v1 numSplitK: 1 numBuffers: 0 numKernels: 1 Tactic: 0x0000000000020070 Time: 0.103803
[11/18/2024-12:09:00] [V] [TRT] Tactic Name: turing_sgemm_128x64_tn_v1 numSplitK: 1 numBuffers: 0 numKernels: 1 Tactic: 0x000000000002003f Time: 0.1096
[11/18/2024-12:09:00] [V] [TRT] Tactic Name: turing_sgemm_128x64_relu_tn_v1 numSplitK: 1 numBuffers: 0 numKernels: 1 Tactic: 0x0000000000020683 Time: 0.0842903
[11/18/2024-12:09:00] [V] [TRT] Tactic Name: turing_sgemm_128x64_relu_nn_v1 numSplitK: 1 numBuffers: 0 numKernels: 1 Tactic: 0x000000000002003a Time: 0.0786537
[11/18/2024-12:09:00] [V] [TRT] Tactic Name: volta_sgemm_128x64_relu_tn_v1 numSplitK: 1 numBuffers: 0 numKernels: 1 Tactic: 0x0000000000020028 Time: 0.0845691
[11/18/2024-12:09:00] [V] [TRT] Tactic Name: turing_sgemm_128x128_relu_nn_v1 numSplitK: 1 numBuffers: 0 numKernels: 1 Tactic: 0x0000000000020838 Time: 0.0811154
[11/18/2024-12:09:00] [V] [TRT] Tactic Name: volta_sgemm_128x128_relu_nn_v1 numSplitK: 1 numBuffers: 0 numKernels: 1 Tactic: 0x0000000000020061 Time: 0.0809943
[11/18/2024-12:09:00] [V] [TRT] Tactic Name: volta_sgemm_128x128_relu_tn_v1 numSplitK: 1 numBuffers: 0 numKernels: 1 Tactic: 0x0000000000020134 Time: 0.0852526
[11/18/2024-12:09:00] [V] [TRT] Tactic Name: turing_sgemm_128x128_tn_v1 numSplitK: 1 numBuffers: 0 numKernels: 1 Tactic: 0x00000000000206ff Time: 0.111081
[11/18/2024-12:09:00] [V] [TRT] Tactic Name: turing_sgemm_128x128_nn_v1 numSplitK: 1 numBuffers: 0 numKernels: 1 Tactic: 0x0000000000020203 Time: 0.107659
[11/18/2024-12:09:00] [V] [TRT] Tactic Name: volta_sgemm_128x128_nn_v1 numSplitK: 1 numBuffers: 0 numKernels: 1 Tactic: 0x00000000000205db Time: 0.106983
[11/18/2024-12:09:00] [V] [TRT] Tactic Name: turing_sgemm_128x128_relu_tn_v1 numSplitK: 1 numBuffers: 0 numKernels: 1 Tactic: 0x000000000002029b Time: 0.0853417
[11/18/2024-12:09:00] [V] [TRT] Tactic Name: volta_sgemm_128x128_tn_v1 numSplitK: 1 numBuffers: 0 numKernels: 1 Tactic: 0x0000000000020429 Time: 0.111477
[11/18/2024-12:09:00] [V] [TRT] Tactic Name: volta_sgemm_32x128_nn_v1 numSplitK: 1 numBuffers: 0 numKernels: 1 Tactic: 0x00000000000200c3 Time: 0.154926
[11/18/2024-12:09:00] [V] [TRT] Tactic Name: turing_sgemm_32x128_relu_tn_v1 numSplitK: 1 numBuffers: 0 numKernels: 1 Tactic: 0x0000000000020808 Time: 0.135854
[11/18/2024-12:09:00] [V] [TRT] Tactic Name: turing_sgemm_32x128_tn_v1 numSplitK: 1 numBuffers: 0 numKernels: 1 Tactic: 0x0000000000020747 Time: 0.16256
[11/18/2024-12:09:00] [V] [TRT] Tactic Name: volta_sgemm_32x128_tn_v1 numSplitK: 1 numBuffers: 0 numKernels: 1 Tactic: 0x00000000000200a7 Time: 0.162981
[11/18/2024-12:09:00] [V] [TRT] Tactic Name: volta_sgemm_32x128_relu_nn_v1 numSplitK: 1 numBuffers: 0 numKernels: 1 Tactic: 0x000000000002005c Time: 0.129225
[11/18/2024-12:09:00] [V] [TRT] Tactic Name: turing_sgemm_32x128_relu_nn_v1 numSplitK: 1 numBuffers: 0 numKernels: 1 Tactic: 0x0000000000020636 Time: 0.129511
[11/18/2024-12:09:00] [V] [TRT] Tactic Name: turing_sgemm_32x128_nn_v1 numSplitK: 1 numBuffers: 0 numKernels: 1 Tactic: 0x0000000000020055 Time: 0.154501
[11/18/2024-12:09:00] [V] [TRT] Tactic Name: volta_sgemm_32x128_relu_tn_v1 numSplitK: 1 numBuffers: 0 numKernels: 1 Tactic: 0x000000000002084b Time: 0.136048
[11/18/2024-12:09:00] [V] [TRT] Tactic Name: turing_sgemm_128x32_relu_nn_v1 numSplitK: 1 numBuffers: 0 numKernels: 1 Tactic: 0x0000000000020137 Time: 0.109925
[11/18/2024-12:09:00] [V] [TRT] Tactic Name: turing_sgemm_128x32_tn_v1 numSplitK: 1 numBuffers: 0 numKernels: 1 Tactic: 0x000000000002016f Time: 0.16139
[11/18/2024-12:09:00] [V] [TRT] Tactic Name: volta_sgemm_128x32_tn_v1 numSplitK: 1 numBuffers: 0 numKernels: 1 Tactic: 0x00000000000201b1 Time: 0.161266
[11/18/2024-12:09:00] [V] [TRT] Tactic Name: turing_sgemm_128x32_relu_tn_v1 numSplitK: 1 numBuffers: 0 numKernels: 1 Tactic: 0x0000000000020267 Time: 0.135682
[11/18/2024-12:09:00] [V] [TRT] Tactic Name: volta_sgemm_128x32_relu_nn_v1 numSplitK: 1 numBuffers: 0 numKernels: 1 Tactic: 0x0000000000020020 Time: 0.110137
[11/18/2024-12:09:00] [V] [TRT] Tactic Name: volta_sgemm_128x32_nn_v1 numSplitK: 1 numBuffers: 0 numKernels: 1 Tactic: 0x0000000000020095 Time: 0.136059
[11/18/2024-12:09:00] [V] [TRT] Tactic Name: turing_sgemm_128x32_nn_v1 numSplitK: 1 numBuffers: 0 numKernels: 1 Tactic: 0x0000000000020078 Time: 0.135767
[11/18/2024-12:09:00] [V] [TRT] Tactic Name: volta_sgemm_128x32_relu_tn_v1 numSplitK: 1 numBuffers: 0 numKernels: 1 Tactic: 0x0000000000020079 Time: 0.136825
[11/18/2024-12:09:00] [V] [TRT] Tactic Name: volta_sgemm_64x32_sliced1x4_nn_v1 numSplitK: 1 numBuffers: 0 numKernels: 1 Tactic: 0x0000000000020719 Time: 0.148224
[11/18/2024-12:09:00] [V] [TRT] Tactic Name: turing_sgemm_64x32_sliced1x4_relu_tn_v1 numSplitK: 1 numBuffers: 0 numKernels: 1 Tactic: 0x00000000000203ee Time: 0.150967
[11/18/2024-12:09:00] [V] [TRT] Tactic Name: turing_sgemm_64x32_sliced1x4_nn_v1 numSplitK: 1 numBuffers: 0 numKernels: 1 Tactic: 0x000000000002036b Time: 0.14821
[11/18/2024-12:09:00] [V] [TRT] Tactic Name: turing_sgemm_64x32_sliced1x4_relu_nn_v1 numSplitK: 1 numBuffers: 0 numKernels: 1 Tactic: 0x00000000000207d3 Time: 0.123838
[11/18/2024-12:09:00] [V] [TRT] Tactic Name: volta_sgemm_64x32_sliced1x4_tn_v1 numSplitK: 1 numBuffers: 0 numKernels: 1 Tactic: 0x000000000002020e Time: 0.176485
[11/18/2024-12:09:00] [V] [TRT] Tactic Name: turing_sgemm_64x32_sliced1x4_tn_v1 numSplitK: 1 numBuffers: 0 numKernels: 1 Tactic: 0x000000000002013f Time: 0.176384
[11/18/2024-12:09:00] [V] [TRT] Tactic Name: turing_sgemm_64x64_tn_v1 numSplitK: 2 numBuffers: 1 numKernels: 1 Tactic: 0x0000000002040188 Time: 0.138526
[11/18/2024-12:09:00] [V] [TRT] Tactic Name: volta_sgemm_64x64_tn_v1 numSplitK: 2 numBuffers: 1 numKernels: 1 Tactic: 0x0000000002040477 Time: 0.138974
[11/18/2024-12:09:00] [V] [TRT] Tactic Name: volta_sgemm_64x64_relu_nn_v1 numSplitK: 2 numBuffers: 1 numKernels: 1 Tactic: 0x0000000002040031 Time: 0.101657
[11/18/2024-12:09:00] [V] [TRT] Tactic Name: volta_sgemm_64x64_nn_v1 numSplitK: 2 numBuffers: 1 numKernels: 1 Tactic: 0x0000000002040482 Time: 0.126875
[11/18/2024-12:09:00] [V] [TRT] Tactic Name: turing_sgemm_64x64_relu_tn_v1 numSplitK: 2 numBuffers: 1 numKernels: 1 Tactic: 0x0000000002040244 Time: 0.112373
[11/18/2024-12:09:00] [V] [TRT] Tactic Name: turing_sgemm_64x64_relu_nn_v1 numSplitK: 2 numBuffers: 1 numKernels: 1 Tactic: 0x0000000002040130 Time: 0.101435
[11/18/2024-12:09:00] [V] [TRT] Tactic Name: turing_sgemm_64x64_nn_v1 numSplitK: 2 numBuffers: 1 numKernels: 1 Tactic: 0x00000000020400b2 Time: 0.126869
[11/18/2024-12:09:00] [V] [TRT] Tactic Name: volta_sgemm_64x64_relu_tn_v1 numSplitK: 2 numBuffers: 1 numKernels: 1 Tactic: 0x00000000020400a8 Time: 0.113335
[11/18/2024-12:09:00] [V] [TRT] Tactic Name: turing_sgemm_128x64_relu_tn_v1 numSplitK: 2 numBuffers: 1 numKernels: 1 Tactic: 0x0000000002040683 Time: 0.099472
[11/18/2024-12:09:00] [V] [TRT] Tactic Name: turing_sgemm_128x64_nn_v1 numSplitK: 2 numBuffers: 1 numKernels: 1 Tactic: 0x0000000002040070 Time: 0.117643
[11/18/2024-12:09:00] [V] [TRT] Tactic Name: turing_sgemm_128x64_relu_nn_v1 numSplitK: 2 numBuffers: 1 numKernels: 1 Tactic: 0x000000000204003a Time: 0.0909669
[11/18/2024-12:09:00] [V] [TRT] Tactic Name: turing_sgemm_128x64_tn_v1 numSplitK: 2 numBuffers: 1 numKernels: 1 Tactic: 0x000000000204003f Time: 0.125806
[11/18/2024-12:09:00] [V] [TRT] /gnn/layers.0/attn/proj.1_1/Conv || /gnn/layers.0/attn/proj.0_1/Conv (CaskGemmConvolution[0x8000002e]) profiling completed in 0.262696 seconds. Fastest Tactic: 0x0000000000020111 Time: 0.0786331
[11/18/2024-12:09:00] [V] [TRT] Skipping CaskFlattenConvolution: No valid tactics for /gnn/layers.0/attn/proj.1_1/Conv || /gnn/layers.0/attn/proj.0_1/Conv
[11/18/2024-12:09:00] [V] [TRT] >>>>>>>>>>>>>>> Chose Runner Type: CaskGemmConvolution Tactic: 0x0000000000020111
[11/18/2024-12:09:00] [V] [TRT] *************** Autotuning format combination: Float(E0,1:4,E0,64) where E0=(* 64 feature_number_1) -> Float(E0,1:4,E0,128) where E0=(* 128 feature_number_1) where E0=(* 64 feature_number_1) E1=(* 128 feature_number_1) ***************
[11/18/2024-12:09:00] [V] [TRT] Skipping CaskConvolution: No valid tactics for /gnn/layers.0/attn/proj.1_1/Conv || /gnn/layers.0/attn/proj.0_1/Conv
[11/18/2024-12:09:00] [V] [TRT] Skipping CaskGemmConvolution: No valid tactics for /gnn/layers.0/attn/proj.1_1/Conv || /gnn/layers.0/attn/proj.0_1/Conv
[11/18/2024-12:09:00] [V] [TRT] Skipping CaskFlattenConvolution: No valid tactics for /gnn/layers.0/attn/proj.1_1/Conv || /gnn/layers.0/attn/proj.0_1/Conv
[11/18/2024-12:09:00] [V] [TRT] =============== Computing costs for shuffle_after_/gnn/layers.0/attn/proj.1_1/Conv_output
[11/18/2024-12:09:00] [V] [TRT] *************** Autotuning format combination: Float((* 256 feature_number_1),feature_number_1,feature_number_1,1) -> Float((* 256 feature_number_1),feature_number_1,1,1) where E0=(* 256 feature_number_1) ***************
[11/18/2024-12:09:00] [V] [TRT] --------------- Timing Runner: shuffle_after_/gnn/layers.0/attn/proj.1_1/Conv_output (Shuffle[0x8000000d])
[11/18/2024-12:09:00] [V] [TRT] Tactic: 0x0000000000000000 Time: 0.0137762
[11/18/2024-12:09:00] [V] [TRT] Tactic: 0x0000000000000001 Time: 0.0283101
[11/18/2024-12:09:00] [V] [TRT] shuffle_after_/gnn/layers.0/attn/proj.1_1/Conv_output (Shuffle[0x8000000d]) profiling completed in 0.00376477 seconds. Fastest Tactic: 0x0000000000000000 Time: 0.0137762
[11/18/2024-12:09:00] [V] [TRT] >>>>>>>>>>>>>>> Chose Runner Type: Shuffle Tactic: 0x0000000000000000
[11/18/2024-12:09:00] [V] [TRT] *************** Autotuning format combination: Float((* 256 feature_number_1),feature_number_1,feature_number_1,1) -> Float((* 64 feature_number_1),1:4,64,64) ***************
[11/18/2024-12:09:00] [V] [TRT] --------------- Timing Runner: shuffle_after_/gnn/layers.0/attn/proj.1_1/Conv_output (Shuffle[0x8000000d])
[11/18/2024-12:09:00] [V] [TRT] Tactic: 0x0000000000000000 Time: 0.0425897
[11/18/2024-12:09:00] [V] [TRT] shuffle_after_/gnn/layers.0/attn/proj.1_1/Conv_output (Shuffle[0x8000000d]) profiling completed in 0.00171858 seconds. Fastest Tactic: 0x0000000000000000 Time: 0.0425897
[11/18/2024-12:09:00] [V] [TRT] >>>>>>>>>>>>>>> Chose Runner Type: Shuffle Tactic: 0x0000000000000000
[11/18/2024-12:09:00] [V] [TRT] *************** Autotuning format combination: Float(E0,1,E0,256) where E0=(* 256 feature_number_1) -> Float((* 256 feature_number_1),1,256,256) where E0=(* 256 feature_number_1) ***************
[11/18/2024-12:09:00] [V] [TRT] --------------- Timing Runner: shuffle_after_/gnn/layers.0/attn/proj.1_1/Conv_output (Shuffle[0x8000000d])
[11/18/2024-12:09:00] [V] [TRT] Tactic: 0x0000000000000000 Time: 0.0535893
[11/18/2024-12:09:00] [V] [TRT] Tactic: 0x0000000000000001 Time: 0.0302565
[11/18/2024-12:09:00] [V] [TRT] shuffle_after_/gnn/layers.0/attn/proj.1_1/Conv_output (Shuffle[0x8000000d]) profiling completed in 0.00311696 seconds. Fastest Tactic: 0x0000000000000001 Time: 0.0302565
[11/18/2024-12:09:00] [V] [TRT] >>>>>>>>>>>>>>> Chose Runner Type: Shuffle Tactic: 0x0000000000000001
[11/18/2024-12:09:00] [V] [TRT] *************** Autotuning format combination: Float(E0,1:4,E0,64) where E0=(* 64 feature_number_1) -> Float((* 256 feature_number_1),feature_number_1,1,1) where E0=(* 64 feature_number_1) ***************
[11/18/2024-12:09:00] [V] [TRT] --------------- Timing Runner: shuffle_after_/gnn/layers.0/attn/proj.1_1/Conv_output (Shuffle[0x8000000d])
[11/18/2024-12:09:00] [V] [TRT] Tactic: 0x0000000000000000 Time: 0.0258598
[11/18/2024-12:09:00] [V] [TRT] shuffle_after_/gnn/layers.0/attn/proj.1_1/Conv_output (Shuffle[0x8000000d]) profiling completed in 0.00151233 seconds. Fastest Tactic: 0x0000000000000000 Time: 0.0258598
[11/18/2024-12:09:00] [V] [TRT] >>>>>>>>>>>>>>> Chose Runner Type: Shuffle Tactic: 0x0000000000000000
[11/18/2024-12:09:00] [V] [TRT] *************** Autotuning format combination: Float(E0,1:4,E0,64) where E0=(* 64 feature_number_1) -> Float((* 64 feature_number_1),1:4,64,64) where E0=(* 64 feature_number_1) ***************
[11/18/2024-12:09:00] [V] [TRT] --------------- Timing Runner: shuffle_after_/gnn/layers.0/attn/proj.1_1/Conv_output (Shuffle[0x8000000d])
[11/18/2024-12:09:00] [V] [TRT] Tactic: 0x0000000000000000 Time: 0.0535238
[11/18/2024-12:09:00] [V] [TRT] Tactic: 0x0000000000000001 Time: 0.0305362
[11/18/2024-12:09:00] [V] [TRT] shuffle_after_/gnn/layers.0/attn/proj.1_1/Conv_output (Shuffle[0x8000000d]) profiling completed in 0.00320047 seconds. Fastest Tactic: 0x0000000000000001 Time: 0.0305362
[11/18/2024-12:09:00] [V] [TRT] >>>>>>>>>>>>>>> Chose Runner Type: Shuffle Tactic: 0x0000000000000001
[11/18/2024-12:09:00] [V] [TRT] *************** Autotuning format combination: Float((* 8 feature_number_1),feature_number_1:32,feature_number_1,1) -> Float((* 8 feature_number_1),feature_number_1:32,1,1) where E0=(* 8 feature_number_1) ***************
[11/18/2024-12:09:00] [V] [TRT] --------------- Timing Runner: shuffle_after_/gnn/layers.0/attn/proj.1_1/Conv_output (Shuffle[0x8000000d])
[11/18/2024-12:09:00] [V] [TRT] Tactic: 0x0000000000000000 Time: 0.013856
[11/18/2024-12:09:00] [V] [TRT] Tactic: 0x0000000000000001 Time: 0.0301138
[11/18/2024-12:09:00] [V] [TRT] shuffle_after_/gnn/layers.0/attn/proj.1_1/Conv_output (Shuffle[0x8000000d]) profiling completed in 0.00325562 seconds. Fastest Tactic: 0x0000000000000000 Time: 0.013856
[11/18/2024-12:09:00] [V] [TRT] >>>>>>>>>>>>>>> Chose Runner Type: Shuffle Tactic: 0x0000000000000000
[11/18/2024-12:09:00] [V] [TRT] =============== Computing costs for shuffle_after_/gnn/layers.0/attn/proj.0_1/Conv_output
[11/18/2024-12:09:00] [V] [TRT] shuffle_after_/gnn/layers.0/attn/proj.0_1/Conv_output [Float((* 256 feature_number_1),feature_number_1,feature_number_1,1) -> Float((* 256 feature_number_1),feature_number_1,1,1) where E0=(* 256 feature_number_1)] got cached result: Shuffle, tactic 0x0000000000000000, 0 ms
[11/18/2024-12:09:00] [V] [TRT] shuffle_after_/gnn/layers.0/attn/proj.0_1/Conv_output [Float((* 256 feature_number_1),feature_number_1,feature_number_1,1) -> Float((* 64 feature_number_1),1:4,64,64)] got cached result: Shuffle, tactic 0x0000000000000000, 0.0425897 ms
[11/18/2024-12:09:00] [V] [TRT] shuffle_after_/gnn/layers.0/attn/proj.0_1/Conv_output [Float(E0,1,E0,256) where E0=(* 256 feature_number_1) -> Float((* 256 feature_number_1),1,256,256) where E0=(* 256 feature_number_1)] got cached result: Shuffle, tactic 0x0000000000000001, 0 ms
[11/18/2024-12:09:00] [V] [TRT] shuffle_after_/gnn/layers.0/attn/proj.0_1/Conv_output [Float(E0,1:4,E0,64) where E0=(* 64 feature_number_1) -> Float((* 256 feature_number_1),feature_number_1,1,1) where E0=(* 64 feature_number_1)] got cached result: Shuffle, tactic 0x0000000000000000, 0.0258598 ms
[11/18/2024-12:09:00] [V] [TRT] shuffle_after_/gnn/layers.0/attn/proj.0_1/Conv_output [Float(E0,1:4,E0,64) where E0=(* 64 feature_number_1) -> Float((* 64 feature_number_1),1:4,64,64) where E0=(* 64 feature_number_1)] got cached result: Shuffle, tactic 0x0000000000000001, 0 ms
[11/18/2024-12:09:00] [V] [TRT] shuffle_after_/gnn/layers.0/attn/proj.0_1/Conv_output [Float((* 8 feature_number_1),feature_number_1:32,feature_number_1,1) -> Float((* 8 feature_number_1),feature_number_1:32,1,1) where E0=(* 8 feature_number_1)] got cached result: Shuffle, tactic 0x0000000000000000, 0 ms
[11/18/2024-12:09:00] [V] [TRT] =============== Computing costs for shuffle_between_ONNXTRT_unsqueezeTensor_output_and_/gnn/layers.0/attn/proj.1/Conv
[11/18/2024-12:09:00] [V] [TRT] shuffle_between_ONNXTRT_unsqueezeTensor_output_and_/gnn/layers.0/attn/proj.1/Conv [Float((* 256 feature_number_0),feature_number_0,1,1) -> Float((* 256 feature_number_0),feature_number_0,feature_number_0,1) where E0=(* 256 feature_number_0)] got cached result: Shuffle, tactic 0x0000000000000000, 0 ms
[11/18/2024-12:09:00] [V] [TRT] shuffle_between_ONNXTRT_unsqueezeTensor_output_and_/gnn/layers.0/attn/proj.1/Conv [Float((* 256 feature_number_0),feature_number_0,1,1) -> Float(E0,1:4,E0,64) where E0=(* 64 feature_number_0) where E0=(* 64 feature_number_0)] got cached result: Shuffle, tactic 0x0000000000000000, 0.0282888 ms
[11/18/2024-12:09:00] [V] [TRT] shuffle_between_ONNXTRT_unsqueezeTensor_output_and_/gnn/layers.0/attn/proj.1/Conv [Float((* 256 feature_number_0),1,256,256) -> Float(E0,1,E0,256) where E0=(* 256 feature_number_0) where E0=(* 256 feature_number_0)] got cached result: Shuffle, tactic 0x0000000000000000, 0 ms
[11/18/2024-12:09:00] [V] [TRT] shuffle_between_ONNXTRT_unsqueezeTensor_output_and_/gnn/layers.0/attn/proj.1/Conv [Float((* 64 feature_number_0),1:4,64,64) -> Float((* 256 feature_number_0),feature_number_0,feature_number_0,1)] got cached result: Shuffle, tactic 0x0000000000000000, 0.03376 ms
[11/18/2024-12:09:00] [V] [TRT] shuffle_between_ONNXTRT_unsqueezeTensor_output_and_/gnn/layers.0/attn/proj.1/Conv [Float((* 64 feature_number_0),1:4,64,64) -> Float(E0,1:4,E0,64) where E0=(* 64 feature_number_0) where E0=(* 64 feature_number_0)] got cached result: Shuffle, tactic 0x0000000000000000, 0 ms
[11/18/2024-12:09:00] [V] [TRT] shuffle_between_ONNXTRT_unsqueezeTensor_output_and_/gnn/layers.0/attn/proj.1/Conv [Float((* 8 feature_number_0),feature_number_0:32,1,1) -> Float((* 8 feature_number_0),feature_number_0:32,feature_number_0,1) where E0=(* 8 feature_number_0)] got cached result: Shuffle, tactic 0x0000000000000000, 0 ms
[11/18/2024-12:09:00] [V] [TRT] =============== Computing costs for /gnn/layers.0/attn/proj.1/Conv || /gnn/layers.0/attn/proj.0/Conv
[11/18/2024-12:09:00] [V] [TRT] /gnn/layers.0/attn/proj.1/Conv || /gnn/layers.0/attn/proj.0/Conv [Float((* 256 feature_number_0),feature_number_0,feature_number_0,1) -> Float((* 512 feature_number_0),feature_number_0,feature_number_0,1)] got cached result: CaskConvolution, tactic 0x7e29bdfccd92c42c, 0.0839566 ms
[11/18/2024-12:09:00] [V] [TRT] /gnn/layers.0/attn/proj.1/Conv || /gnn/layers.0/attn/proj.0/Conv: 116 available tactics, 0 unparsable, 58 pruned, 58 remaining after tactic pruning.
[11/18/2024-12:09:00] [V] [TRT] /gnn/layers.0/attn/proj.1/Conv || /gnn/layers.0/attn/proj.0/Conv [Float(E0,1,E0,256) where E0=(* 256 feature_number_0) -> Float(E0,1,E0,512) where E0=(* 512 feature_number_0) where E0=(* 256 feature_number_0) E1=(* 512 feature_number_0)] got cached result: CaskGemmConvolution, tactic 0x0000000000020111, 0.0786331 ms
[11/18/2024-12:09:00] [V] [TRT] *************** Autotuning format combination: Float(E0,1:4,E0,64) where E0=(* 64 feature_number_0) -> Float(E0,1:4,E0,128) where E0=(* 128 feature_number_0) where E0=(* 64 feature_number_0) E1=(* 128 feature_number_0) ***************
[11/18/2024-12:09:00] [V] [TRT] Skipping CaskConvolution: No valid tactics for /gnn/layers.0/attn/proj.1/Conv || /gnn/layers.0/attn/proj.0/Conv
[11/18/2024-12:09:00] [V] [TRT] Skipping CaskGemmConvolution: No valid tactics for /gnn/layers.0/attn/proj.1/Conv || /gnn/layers.0/attn/proj.0/Conv
[11/18/2024-12:09:00] [V] [TRT] Skipping CaskFlattenConvolution: No valid tactics for /gnn/layers.0/attn/proj.1/Conv || /gnn/layers.0/attn/proj.0/Conv
[11/18/2024-12:09:00] [V] [TRT] =============== Computing costs for shuffle_after_/gnn/layers.0/attn/proj.1/Conv_output
[11/18/2024-12:09:00] [V] [TRT] shuffle_after_/gnn/layers.0/attn/proj.1/Conv_output [Float((* 256 feature_number_0),feature_number_0,feature_number_0,1) -> Float((* 256 feature_number_0),feature_number_0,1,1) where E0=(* 256 feature_number_0)] got cached result: Shuffle, tactic 0x0000000000000000, 0 ms
[11/18/2024-12:09:00] [V] [TRT] shuffle_after_/gnn/layers.0/attn/proj.1/Conv_output [Float((* 256 feature_number_0),feature_number_0,feature_number_0,1) -> Float((* 64 feature_number_0),1:4,64,64)] got cached result: Shuffle, tactic 0x0000000000000000, 0.0425897 ms
[11/18/2024-12:09:00] [V] [TRT] shuffle_after_/gnn/layers.0/attn/proj.1/Conv_output [Float(E0,1,E0,256) where E0=(* 256 feature_number_0) -> Float((* 256 feature_number_0),1,256,256) where E0=(* 256 feature_number_0)] got cached result: Shuffle, tactic 0x0000000000000001, 0 ms
[11/18/2024-12:09:00] [V] [TRT] shuffle_after_/gnn/layers.0/attn/proj.1/Conv_output [Float(E0,1:4,E0,64) where E0=(* 64 feature_number_0) -> Float((* 256 feature_number_0),feature_number_0,1,1) where E0=(* 64 feature_number_0)] got cached result: Shuffle, tactic 0x0000000000000000, 0.0258598 ms
[11/18/2024-12:09:00] [V] [TRT] shuffle_after_/gnn/layers.0/attn/proj.1/Conv_output [Float(E0,1:4,E0,64) where E0=(* 64 feature_number_0) -> Float((* 64 feature_number_0),1:4,64,64) where E0=(* 64 feature_number_0)] got cached result: Shuffle, tactic 0x0000000000000001, 0 ms
[11/18/2024-12:09:00] [V] [TRT] shuffle_after_/gnn/layers.0/attn/proj.1/Conv_output [Float((* 8 feature_number_0),feature_number_0:32,feature_number_0,1) -> Float((* 8 feature_number_0),feature_number_0:32,1,1) where E0=(* 8 feature_number_0)] got cached result: Shuffle, tactic 0x0000000000000000, 0 ms
[11/18/2024-12:09:00] [V] [TRT] =============== Computing costs for shuffle_after_/gnn/layers.0/attn/proj.0/Conv_output
[11/18/2024-12:09:00] [V] [TRT] shuffle_after_/gnn/layers.0/attn/proj.0/Conv_output [Float((* 256 feature_number_0),feature_number_0,feature_number_0,1) -> Float((* 256 feature_number_0),feature_number_0,1,1) where E0=(* 256 feature_number_0)] got cached result: Shuffle, tactic 0x0000000000000000, 0 ms
[11/18/2024-12:09:00] [V] [TRT] shuffle_after_/gnn/layers.0/attn/proj.0/Conv_output [Float((* 256 feature_number_0),feature_number_0,feature_number_0,1) -> Float((* 64 feature_number_0),1:4,64,64)] got cached result: Shuffle, tactic 0x0000000000000000, 0.0425897 ms
[11/18/2024-12:09:00] [V] [TRT] shuffle_after_/gnn/layers.0/attn/proj.0/Conv_output [Float(E0,1,E0,256) where E0=(* 256 feature_number_0) -> Float((* 256 feature_number_0),1,256,256) where E0=(* 256 feature_number_0)] got cached result: Shuffle, tactic 0x0000000000000001, 0 ms
[11/18/2024-12:09:00] [V] [TRT] shuffle_after_/gnn/layers.0/attn/proj.0/Conv_output [Float(E0,1:4,E0,64) where E0=(* 64 feature_number_0) -> Float((* 256 feature_number_0),feature_number_0,1,1) where E0=(* 64 feature_number_0)] got cached result: Shuffle, tactic 0x0000000000000000, 0.0258598 ms
[11/18/2024-12:09:00] [V] [TRT] shuffle_after_/gnn/layers.0/attn/proj.0/Conv_output [Float(E0,1:4,E0,64) where E0=(* 64 feature_number_0) -> Float((* 64 feature_number_0),1:4,64,64) where E0=(* 64 feature_number_0)] got cached result: Shuffle, tactic 0x0000000000000001, 0 ms
[11/18/2024-12:09:00] [V] [TRT] shuffle_after_/gnn/layers.0/attn/proj.0/Conv_output [Float((* 8 feature_number_0),feature_number_0:32,feature_number_0,1) -> Float((* 8 feature_number_0),feature_number_0:32,1,1) where E0=(* 8 feature_number_0)] got cached result: Shuffle, tactic 0x0000000000000000, 0 ms
[11/18/2024-12:09:00] [V] [TRT] =============== Computing costs for {ForeignNode[ONNXTRT_squeezeTensor_49 + /gnn/layers.0/attn_1/Reshape + /gnn/layers.0/attn_1/Transpose.../gnn/layers.0/attn_1/MatMul]}
[11/18/2024-12:09:00] [V] [TRT] *************** Autotuning format combination: Float((* 256 feature_number_1),feature_number_1,1,1), Float((* 256 feature_number_1),feature_number_1,1,1), Float((* 256 feature_number_0),feature_number_0,1,1), Float((* 256 feature_number_0),feature_number_0,1,1) -> Float((* 256 feature_number_0),(* 64 feature_number_0),64,1), Float((* 256 feature_number_1),(* 64 feature_number_1),64,1), Float((* 4 E0),E0,feature_number_0,1) where E0=(* feature_number_0 feature_number_0), Float((* 4 E0),E0,feature_number_1,1) where E0=(* feature_number_1 feature_number_1) where E0=(* 256 feature_number_1) E1=(* 256 feature_number_0) E2=(* feature_number_0 feature_number_0) E3=(* feature_number_1 feature_number_1) ***************
[11/18/2024-12:09:00] [V] [TRT] --------------- Timing Runner: {ForeignNode[ONNXTRT_squeezeTensor_49 + /gnn/layers.0/attn_1/Reshape + /gnn/layers.0/attn_1/Transpose.../gnn/layers.0/attn_1/MatMul]} (Myelin[0x80000023])
[11/18/2024-12:09:00] [I] [TRT] Compiler backend is used during engine build.
[11/18/2024-12:09:01] [V] [TRT]  (foreignNode) Set user's cuda kernel library
[11/18/2024-12:09:01] [V] [TRT] Subgraph compilation completed in 0.317 seconds.
[11/18/2024-12:09:01] [V] [TRT] Tactic: 0x0000000000000000 Time: 0.403163
[11/18/2024-12:09:01] [V] [TRT] {ForeignNode[ONNXTRT_squeezeTensor_49 + /gnn/layers.0/attn_1/Reshape + /gnn/layers.0/attn_1/Transpose.../gnn/layers.0/attn_1/MatMul]} (Myelin[0x80000023]) profiling completed in 0.360814 seconds. Fastest Tactic: 0x0000000000000000 Time: 0.403163
[11/18/2024-12:09:01] [V] [TRT] >>>>>>>>>>>>>>> Chose Runner Type: Myelin Tactic: 0x0000000000000000
[11/18/2024-12:09:01] [V] [TRT] =============== Computing reformatting costs for available format set
[11/18/2024-12:09:01] [V] [TRT] =============== Computing reformatting costs: 
[11/18/2024-12:09:01] [V] [TRT] *************** Autotuning Reformat: Float((* 256 feature_number_0),feature_number_0,1) -> Float(1,feature_number_0,1) ***************
[11/18/2024-12:09:01] [V] [TRT] --------------- Timing Runner: Optimizer Reformat(descriptors_0 -> <out>) (Reformat[0x80000006])
[11/18/2024-12:09:01] [V] [TRT] Tactic: 0x00000000000003e8 Time: 0.014885
[11/18/2024-12:09:01] [V] [TRT] Tactic: 0x00000000000003ea Time: 0.0144567
[11/18/2024-12:09:01] [V] [TRT] Tactic: 0x0000000000000000 Time: 0.10904
[11/18/2024-12:09:01] [V] [TRT] Optimizer Reformat(descriptors_0 -> <out>) (Reformat[0x80000006]) profiling completed in 0.00626425 seconds. Fastest Tactic: 0x00000000000003ea Time: 0.0144567
