lix19937/static_lix.log
[11/18/2024-12:09:45] [V] [TRT] *************** Autotuning format combination: Float(25600,100,1) -> Float(25600,100,1,1) ***************
[11/18/2024-12:09:45] [V] [TRT] --------------- Timing Runner: ONNXTRT_unsqueezeTensor (Shuffle[0x8000000d])
[11/18/2024-12:09:45] [V] [TRT] Tactic: 0x0000000000000000 Time: 0.00396331
[11/18/2024-12:09:45] [V] [TRT] Tactic: 0x0000000000000001 Time: 0.0207745
[11/18/2024-12:09:45] [V] [TRT] ONNXTRT_unsqueezeTensor (Shuffle[0x8000000d]) profiling completed in 0.00997655 seconds. Fastest Tactic: 0x0000000000000000 Time: 0.00396331
[11/18/2024-12:09:45] [V] [TRT] >>>>>>>>>>>>>>> Chose Runner Type: Shuffle Tactic: 0x0000000000000000
[11/18/2024-12:09:45] [V] [TRT] *************** Autotuning format combination: Float(25600,100,1) -> Float(6400,1:4,64,64) ***************
[11/18/2024-12:09:45] [V] [TRT] --------------- Timing Runner: ONNXTRT_unsqueezeTensor (Shuffle[0x8000000d])
[11/18/2024-12:09:45] [V] [TRT] Tactic: 0x0000000000000000 Time: 0.0079052
[11/18/2024-12:09:45] [V] [TRT] ONNXTRT_unsqueezeTensor (Shuffle[0x8000000d]) profiling completed in 0.00454037 seconds. Fastest Tactic: 0x0000000000000000 Time: 0.0079052
[11/18/2024-12:09:45] [V] [TRT] >>>>>>>>>>>>>>> Chose Runner Type: Shuffle Tactic: 0x0000000000000000
[11/18/2024-12:09:45] [V] [TRT] *************** Autotuning format combination: Float(1,100,1) -> Float(25600,1,256,256) ***************
[11/18/2024-12:09:45] [V] [TRT] --------------- Timing Runner: ONNXTRT_unsqueezeTensor (Shuffle[0x8000000d])
[11/18/2024-12:09:45] [V] [TRT] Tactic: 0x0000000000000000 Time: 0.00789847
[11/18/2024-12:09:45] [V] [TRT] Tactic: 0x0000000000000001 Time: 0.0213486
[11/18/2024-12:09:45] [V] [TRT] ONNXTRT_unsqueezeTensor (Shuffle[0x8000000d]) profiling completed in 0.00351165 seconds. Fastest Tactic: 0x0000000000000000 Time: 0.00789847
[11/18/2024-12:09:45] [V] [TRT] >>>>>>>>>>>>>>> Chose Runner Type: Shuffle Tactic: 0x0000000000000000
[11/18/2024-12:09:45] [V] [TRT] *************** Autotuning format combination: Float(1:4,100,1) -> Float(25600,100,1,1) ***************
[11/18/2024-12:09:45] [V] [TRT] --------------- Timing Runner: ONNXTRT_unsqueezeTensor (Shuffle[0x8000000d])
[11/18/2024-12:09:45] [V] [TRT] Tactic: 0x0000000000000000 Time: 0.00413793
[11/18/2024-12:09:45] [V] [TRT] ONNXTRT_unsqueezeTensor (Shuffle[0x8000000d]) profiling completed in 0.0022277 seconds. Fastest Tactic: 0x0000000000000000 Time: 0.00413793
[11/18/2024-12:09:45] [V] [TRT] >>>>>>>>>>>>>>> Chose Runner Type: Shuffle Tactic: 0x0000000000000000
[11/18/2024-12:09:45] [V] [TRT] *************** Autotuning format combination: Float(1:4,100,1) -> Float(6400,1:4,64,64) ***************
[11/18/2024-12:09:45] [V] [TRT] --------------- Timing Runner: ONNXTRT_unsqueezeTensor (Shuffle[0x8000000d])
[11/18/2024-12:09:45] [V] [TRT] Tactic: 0x0000000000000000 Time: 0.00814603
[11/18/2024-12:09:45] [V] [TRT] Tactic: 0x0000000000000001 Time: 0.0702979
[11/18/2024-12:09:45] [V] [TRT] ONNXTRT_unsqueezeTensor (Shuffle[0x8000000d]) profiling completed in 0.00388743 seconds. Fastest Tactic: 0x0000000000000000 Time: 0.00814603
[11/18/2024-12:09:45] [V] [TRT] >>>>>>>>>>>>>>> Chose Runner Type: Shuffle Tactic: 0x0000000000000000
[11/18/2024-12:09:45] [V] [TRT] *************** Autotuning format combination: Float(25600:32,100,1) -> Float(800,100:32,1,1) ***************
[11/18/2024-12:09:45] [V] [TRT] --------------- Timing Runner: ONNXTRT_unsqueezeTensor (Shuffle[0x8000000d])
[11/18/2024-12:09:45] [V] [TRT] Tactic: 0x0000000000000000 Time: 0.0159939
[11/18/2024-12:09:45] [V] [TRT] Tactic: 0x0000000000000001 Time: 0.0710766
[11/18/2024-12:09:45] [V] [TRT] ONNXTRT_unsqueezeTensor (Shuffle[0x8000000d]) profiling completed in 0.00378313 seconds. Fastest Tactic: 0x0000000000000000 Time: 0.0159939
[11/18/2024-12:09:45] [V] [TRT] >>>>>>>>>>>>>>> Chose Runner Type: Shuffle Tactic: 0x0000000000000000
[11/18/2024-12:09:45] [V] [TRT] =============== Computing costs for ONNXTRT_unsqueezeTensor_42
[11/18/2024-12:09:45] [V] [TRT] *************** Autotuning format combination: Float(1280,5,1) -> Float(1280,5,1,1) ***************
[11/18/2024-12:09:45] [V] [TRT] --------------- Timing Runner: ONNXTRT_unsqueezeTensor_42 (Shuffle[0x8000000d])
[11/18/2024-12:09:45] [V] [TRT] Tactic: 0x0000000000000000 Time: 0.004224
[11/18/2024-12:09:45] [V] [TRT] Tactic: 0x0000000000000001 Time: 0.0219474
[11/18/2024-12:09:45] [V] [TRT] ONNXTRT_unsqueezeTensor_42 (Shuffle[0x8000000d]) profiling completed in 0.00339184 seconds. Fastest Tactic: 0x0000000000000000 Time: 0.004224
[11/18/2024-12:09:45] [V] [TRT] >>>>>>>>>>>>>>> Chose Runner Type: Shuffle Tactic: 0x0000000000000000
[11/18/2024-12:09:45] [V] [TRT] *************** Autotuning format combination: Float(1280,5,1) -> Float(320,1:4,64,64) ***************
[11/18/2024-12:09:45] [V] [TRT] --------------- Timing Runner: ONNXTRT_unsqueezeTensor_42 (Shuffle[0x8000000d])
[11/18/2024-12:09:45] [V] [TRT] Tactic: 0x0000000000000000 Time: 0.00372876
[11/18/2024-12:09:45] [V] [TRT] ONNXTRT_unsqueezeTensor_42 (Shuffle[0x8000000d]) profiling completed in 0.0017356 seconds. Fastest Tactic: 0x0000000000000000 Time: 0.00372876
[11/18/2024-12:09:45] [V] [TRT] >>>>>>>>>>>>>>> Chose Runner Type: Shuffle Tactic: 0x0000000000000000
[11/18/2024-12:09:45] [V] [TRT] *************** Autotuning format combination: Float(1,5,1) -> Float(1280,1,256,256) ***************
[11/18/2024-12:09:45] [V] [TRT] --------------- Timing Runner: ONNXTRT_unsqueezeTensor_42 (Shuffle[0x8000000d])
[11/18/2024-12:09:45] [V] [TRT] Tactic: 0x0000000000000000 Time: 0.00371458
[11/18/2024-12:09:45] [V] [TRT] Tactic: 0x0000000000000001 Time: 0.0213205
[11/18/2024-12:09:45] [V] [TRT] ONNXTRT_unsqueezeTensor_42 (Shuffle[0x8000000d]) profiling completed in 0.00334503 seconds. Fastest Tactic: 0x0000000000000000 Time: 0.00371458
[11/18/2024-12:09:45] [V] [TRT] >>>>>>>>>>>>>>> Chose Runner Type: Shuffle Tactic: 0x0000000000000000
[11/18/2024-12:09:45] [V] [TRT] *************** Autotuning format combination: Float(1:4,5,1) -> Float(1280,5,1,1) ***************
[11/18/2024-12:09:45] [V] [TRT] --------------- Timing Runner: ONNXTRT_unsqueezeTensor_42 (Shuffle[0x8000000d])
[11/18/2024-12:09:45] [V] [TRT] Tactic: 0x0000000000000000 Time: 0.00373791
[11/18/2024-12:09:45] [V] [TRT] ONNXTRT_unsqueezeTensor_42 (Shuffle[0x8000000d]) profiling completed in 0.00172263 seconds. Fastest Tactic: 0x0000000000000000 Time: 0.00373791
[11/18/2024-12:09:45] [V] [TRT] >>>>>>>>>>>>>>> Chose Runner Type: Shuffle Tactic: 0x0000000000000000
[11/18/2024-12:09:45] [V] [TRT] *************** Autotuning format combination: Float(1:4,5,1) -> Float(320,1:4,64,64) ***************
[11/18/2024-12:09:45] [V] [TRT] --------------- Timing Runner: ONNXTRT_unsqueezeTensor_42 (Shuffle[0x8000000d])
[11/18/2024-12:09:45] [V] [TRT] Tactic: 0x0000000000000000 Time: 0.00388275
[11/18/2024-12:09:45] [V] [TRT] Tactic: 0x0000000000000001 Time: 0.0220839
[11/18/2024-12:09:45] [V] [TRT] ONNXTRT_unsqueezeTensor_42 (Shuffle[0x8000000d]) profiling completed in 0.00335979 seconds. Fastest Tactic: 0x0000000000000000 Time: 0.00388275
[11/18/2024-12:09:45] [V] [TRT] >>>>>>>>>>>>>>> Chose Runner Type: Shuffle Tactic: 0x0000000000000000
[11/18/2024-12:09:45] [V] [TRT] *************** Autotuning format combination: Float(1280:32,5,1) -> Float(40,5:32,1,1) ***************
[11/18/2024-12:09:45] [V] [TRT] --------------- Timing Runner: ONNXTRT_unsqueezeTensor_42 (Shuffle[0x8000000d])
[11/18/2024-12:09:45] [V] [TRT] Tactic: 0x0000000000000000 Time: 0.00359063
[11/18/2024-12:09:45] [V] [TRT] Tactic: 0x0000000000000001 Time: 0.0216438
[11/18/2024-12:09:45] [V] [TRT] ONNXTRT_unsqueezeTensor_42 (Shuffle[0x8000000d]) profiling completed in 0.00339275 seconds. Fastest Tactic: 0x0000000000000000 Time: 0.00359063
[11/18/2024-12:09:45] [V] [TRT] >>>>>>>>>>>>>>> Chose Runner Type: Shuffle Tactic: 0x0000000000000000
[11/18/2024-12:09:45] [V] [TRT] =============== Computing costs for shuffle_between_ONNXTRT_unsqueezeTensor_42_output_and_/gnn/layers.0/attn/proj.1_1/Conv
[11/18/2024-12:09:45] [V] [TRT] *************** Autotuning format combination: Float(1280,5,1,1) -> Float(1280,5,5,1) ***************
[11/18/2024-12:09:45] [V] [TRT] --------------- Timing Runner: shuffle_between_ONNXTRT_unsqueezeTensor_42_output_and_/gnn/layers.0/attn/proj.1_1/Conv (Shuffle[0x8000000d])
[11/18/2024-12:09:45] [V] [TRT] Tactic: 0x0000000000000000 Time: 0.00412434
[11/18/2024-12:09:45] [V] [TRT] Tactic: 0x0000000000000001 Time: 0.0216647
[11/18/2024-12:09:45] [V] [TRT] shuffle_between_ONNXTRT_unsqueezeTensor_42_output_and_/gnn/layers.0/attn/proj.1_1/Conv (Shuffle[0x8000000d]) profiling completed in 0.00321896 seconds. Fastest Tactic: 0x0000000000000000 Time: 0.00412434
[11/18/2024-12:09:45] [V] [TRT] >>>>>>>>>>>>>>> Chose Runner Type: Shuffle Tactic: 0x0000000000000000
[11/18/2024-12:09:45] [V] [TRT] *************** Autotuning format combination: Float(1280,5,1,1) -> Float(320,1:4,320,64) ***************
[11/18/2024-12:09:45] [V] [TRT] --------------- Timing Runner: shuffle_between_ONNXTRT_unsqueezeTensor_42_output_and_/gnn/layers.0/attn/proj.1_1/Conv (Shuffle[0x8000000d])
[11/18/2024-12:09:45] [V] [TRT] Tactic: 0x0000000000000000 Time: 0.00367355
[11/18/2024-12:09:45] [V] [TRT] shuffle_between_ONNXTRT_unsqueezeTensor_42_output_and_/gnn/layers.0/attn/proj.1_1/Conv (Shuffle[0x8000000d]) profiling completed in 0.00171606 seconds. Fastest Tactic: 0x0000000000000000 Time: 0.00367355
[11/18/2024-12:09:45] [V] [TRT] >>>>>>>>>>>>>>> Chose Runner Type: Shuffle Tactic: 0x0000000000000000
[11/18/2024-12:09:45] [V] [TRT] *************** Autotuning format combination: Float(1280,1,256,256) -> Float(1280,1,1280,256) ***************
[11/18/2024-12:09:45] [V] [TRT] --------------- Timing Runner: shuffle_between_ONNXTRT_unsqueezeTensor_42_output_and_/gnn/layers.0/attn/proj.1_1/Conv (Shuffle[0x8000000d])
[11/18/2024-12:09:45] [V] [TRT] Tactic: 0x0000000000000000 Time: 0.00373333
[11/18/2024-12:09:45] [V] [TRT] Tactic: 0x0000000000000001 Time: 0.0218168
[11/18/2024-12:09:45] [V] [TRT] shuffle_between_ONNXTRT_unsqueezeTensor_42_output_and_/gnn/layers.0/attn/proj.1_1/Conv (Shuffle[0x8000000d]) profiling completed in 0.00344918 seconds. Fastest Tactic: 0x0000000000000000 Time: 0.00373333
[11/18/2024-12:09:45] [V] [TRT] >>>>>>>>>>>>>>> Chose Runner Type: Shuffle Tactic: 0x0000000000000000
[11/18/2024-12:09:45] [V] [TRT] *************** Autotuning format combination: Float(320,1:4,64,64) -> Float(1280,5,5,1) ***************
[11/18/2024-12:09:45] [V] [TRT] --------------- Timing Runner: shuffle_between_ONNXTRT_unsqueezeTensor_42_output_and_/gnn/layers.0/attn/proj.1_1/Conv (Shuffle[0x8000000d])
[11/18/2024-12:09:45] [V] [TRT] Tactic: 0x0000000000000000 Time: 0.00373228
[11/18/2024-12:09:45] [V] [TRT] shuffle_between_ONNXTRT_unsqueezeTensor_42_output_and_/gnn/layers.0/attn/proj.1_1/Conv (Shuffle[0x8000000d]) profiling completed in 0.00174014 seconds. Fastest Tactic: 0x0000000000000000 Time: 0.00373228
[11/18/2024-12:09:45] [V] [TRT] >>>>>>>>>>>>>>> Chose Runner Type: Shuffle Tactic: 0x0000000000000000
[11/18/2024-12:09:45] [V] [TRT] *************** Autotuning format combination: Float(320,1:4,64,64) -> Float(320,1:4,320,64) ***************
[11/18/2024-12:09:45] [V] [TRT] --------------- Timing Runner: shuffle_between_ONNXTRT_unsqueezeTensor_42_output_and_/gnn/layers.0/attn/proj.1_1/Conv (Shuffle[0x8000000d])
[11/18/2024-12:09:45] [V] [TRT] Tactic: 0x0000000000000000 Time: 0.00402806
[11/18/2024-12:09:45] [V] [TRT] Tactic: 0x0000000000000001 Time: 0.0218436
[11/18/2024-12:09:45] [V] [TRT] shuffle_between_ONNXTRT_unsqueezeTensor_42_output_and_/gnn/layers.0/attn/proj.1_1/Conv (Shuffle[0x8000000d]) profiling completed in 0.00333956 seconds. Fastest Tactic: 0x0000000000000000 Time: 0.00402806
[11/18/2024-12:09:45] [V] [TRT] >>>>>>>>>>>>>>> Chose Runner Type: Shuffle Tactic: 0x0000000000000000
[11/18/2024-12:09:45] [V] [TRT] *************** Autotuning format combination: Float(40,5:32,1,1) -> Float(40,5:32,5,1) ***************
[11/18/2024-12:09:45] [V] [TRT] --------------- Timing Runner: shuffle_between_ONNXTRT_unsqueezeTensor_42_output_and_/gnn/layers.0/attn/proj.1_1/Conv (Shuffle[0x8000000d])
[11/18/2024-12:09:45] [V] [TRT] Tactic: 0x0000000000000000 Time: 0.00432956
[11/18/2024-12:09:45] [V] [TRT] Tactic: 0x0000000000000001 Time: 0.0220702
[11/18/2024-12:09:45] [V] [TRT] shuffle_between_ONNXTRT_unsqueezeTensor_42_output_and_/gnn/layers.0/attn/proj.1_1/Conv (Shuffle[0x8000000d]) profiling completed in 0.00332789 seconds. Fastest Tactic: 0x0000000000000000 Time: 0.00432956
[11/18/2024-12:09:45] [V] [TRT] >>>>>>>>>>>>>>> Chose Runner Type: Shuffle Tactic: 0x0000000000000000
[11/18/2024-12:09:45] [V] [TRT] =============== Computing costs for /gnn/layers.0/attn/proj.1_1/Conv || /gnn/layers.0/attn/proj.0_1/Conv
[11/18/2024-12:09:45] [V] [TRT] *************** Autotuning format combination: Float(1280,5,5,1) -> Float(2560,5,5,1) ***************
[11/18/2024-12:09:45] [V] [TRT] --------------- Timing Runner: /gnn/layers.0/attn/proj.1_1/Conv || /gnn/layers.0/attn/proj.0_1/Conv (CaskConvolution[0x80000009])
[11/18/2024-12:09:45] [V] [TRT] Tactic Name: volta_scudnn_128x64_relu_medium_nn_v1 Tactic: 0x90238daf8750ddb0 Time: 0.0389634
[11/18/2024-12:09:45] [V] [TRT] Tactic Name: volta_scudnn_128x128_relu_medium_nn_v1 Tactic: 0x195431d38ba5af88 Time: 0.0588099
[11/18/2024-12:09:45] [V] [TRT] Tactic Name: volta_scudnn_128x128_relu_small_nn_v1 Tactic: 0x365602d0613d4c36 Time: 0.0582324
[11/18/2024-12:09:45] [V] [TRT] Tactic Name: volta_scudnn_128x32_relu_small_nn_v1 Tactic: 0xc939b7b0a4d5a05f Time: 0.0418869
[11/18/2024-12:09:45] [V] [TRT] Tactic Name: volta_scudnn_128x32_relu_medium_nn_v1 Tactic: 0xc2a5fc6b5e7cef5e Time: 0.033024
[11/18/2024-12:09:45] [V] [TRT] Tactic Name: volta_scudnn_128x128_relu_interior_nn_v1 Tactic: 0x18597bd4a7d0164d Time: 0.0580693
[11/18/2024-12:09:45] [V] [TRT] Tactic Name: sm50_xmma_conv_fprop_fused_conv_act_fp32_NCHW_fp32_NCHW_KCRS_fp32_fp32_fp32_Accfloat_1_1_cC1_dC1_srcVec2_fltVec1_1_TP3_TQ10_C1_R1_S1_U1_V1 Tactic: 0x053bede31607189f Time: 0.0459291
[11/18/2024-12:09:45] [V] [TRT] Tactic Name: sm50_xmma_conv_fprop_fused_conv_act_fp32_NCHW_fp32_NCHW_KCRS_fp32_fp32_fp32_Accfloat_1_1_cC1_dC1_srcVec1_fltVec4_4_TP6_TQ5_C4_R1_S1_U1_V1 Tactic: 0x3652da2fa8bb0ef3 Time: 0.0295835
[11/18/2024-12:09:45] [V] [TRT] Tactic Name: sm50_xmma_conv_fprop_fused_conv_act_fp32_NCHW_fp32_NCHW_KCRS_fp32_fp32_fp32_Accfloat_1_1_cC1_dC1_srcVec4_fltVec1_1_TP7_TQ4_C8_R1_S1_U1_V1 Tactic: 0x79164861aa018d25 Time: 0.0181034
[11/18/2024-12:09:45] [V] [TRT] Tactic Name: sm50_xmma_conv_fprop_fused_conv_act_fp32_NCHW_fp32_NCHW_KCRS_fp32_fp32_fp32_Accfloat_1_1_cC1_dC1_srcVec4_fltVec1_1_TP7_TQ2_C2_R1_S1_U1_V1 Tactic: 0x001526e231ae2e51 Time: 0.0171271
[11/18/2024-12:09:45] [V] [TRT] Tactic Name: sm50_xmma_conv_fprop_fused_conv_act_fp32_NCHW_fp32_NCHW_KCRS_fp32_fp32_fp32_Accfloat_1_1_cC1_dC1_srcVec4_fltVec1_1_TP2_TQ7_C1_R1_S1_U1_V1 Tactic: 0xdfbf20bf5c5ed39e Time: 0.0275451
[11/18/2024-12:09:45] [V] [TRT] Tactic Name: sm50_xmma_conv_fprop_fused_conv_act_fp32_NCHW_fp32_NCHW_KCRS_fp32_fp32_fp32_Accfloat_1_1_cC1_dC1_srcVec4_fltVec1_1_TP4_TQ8_C8_R1_S1_U1_V1 Tactic: 0xadc24b6dce6a94cc Time: 0.0118404
[11/18/2024-12:09:45] [V] [TRT] Tactic Name: sm50_xmma_conv_fprop_fused_conv_act_fp32_NCHW_fp32_NCHW_KCRS_fp32_fp32_fp32_Accfloat_1_1_cC1_dC1_srcVec2_fltVec2_2_TP7_TQ4_C4_R1_S1_U1_V1 Tactic: 0x361add5e7e5ba900 Time: 0.017506
[11/18/2024-12:09:45] [V] [TRT] Tactic Name: sm50_xmma_conv_fprop_fused_conv_act_fp32_NCHW_fp32_NCHW_KCRS_fp32_fp32_fp32_Accfloat_1_1_cC1_dC1_srcVec2_fltVec2_2_TP4_TQ4_C1_R1_S1_U1_V1 Tactic: 0x13e300b312a555d1 Time: 0.0452229
[11/18/2024-12:09:45] [V] [TRT] Tactic Name: sm50_xmma_conv_fprop_fused_conv_act_fp32_NCHW_fp32_NCHW_KCRS_fp32_fp32_fp32_Accfloat_1_1_cC1_dC1_srcVec1_fltVec4_4_TP1_TQ10_C2_R1_S1_U1_V1 Tactic: 0x9140485476980e7c Time: 0.0378594
[11/18/2024-12:09:45] [V] [TRT] Tactic Name: sm50_xmma_conv_fprop_fused_conv_act_fp32_NCHW_fp32_NCHW_KCRS_fp32_fp32_fp32_Accfloat_1_1_cC1_dC1_srcVec2_fltVec2_2_TP7_TQ2_C2_R1_S1_U1_V1 Tactic: 0xba220b2881c61eb6 Time: 0.0225685
[11/18/2024-12:09:45] [V] [TRT] Tactic Name: sm50_xmma_conv_fprop_fused_conv_act_fp32_NCHW_fp32_NCHW_KCRS_fp32_fp32_fp32_Accfloat_1_1_cC1_dC1_srcVec4_fltVec1_1_TP8_TQ2_C2_R1_S1_U1_V1 Tactic: 0xb1208f5cd1618214 Time: 0.0198777
[11/18/2024-12:09:45] [V] [TRT] Tactic Name: sm70_xmma_fprop_implicit_gemm_f32f32_f32f32_f32_nchwkcrs_nchw_tilesize128x16x8_stage1_warpsize4x1x1_g1_ffma_aligna4_alignc4 Tactic: 0x160b77f4a95ab6d3 Time: 0.0340562
[11/18/2024-12:09:45] [V] [TRT] Tactic Name: sm50_xmma_conv_fprop_fused_conv_act_fp32_NCHW_fp32_NCHW_KCRS_fp32_fp32_fp32_Accfloat_1_1_cC1_dC1_srcVec2_fltVec2_2_TP2_TQ7_C4_R1_S1_U1_V1 Tactic: 0xeb3768a7d0a4636a Time: 0.012997
[11/18/2024-12:09:45] [V] [TRT] Tactic Name: sm50_xmma_conv_fprop_fused_conv_act_fp32_NCHW_fp32_NCHW_KCRS_fp32_fp32_fp32_Accfloat_1_1_cC1_dC1_srcVec2_fltVec1_1_TP3_TQ10_C4_R1_S1_U1_V1 Tactic: 0x8b8488312a95988c Time: 0.0149957
[11/18/2024-12:09:45] [V] [TRT] Tactic Name: sm50_xmma_conv_fprop_fused_conv_act_fp32_NCHW_fp32_NCHW_KCRS_fp32_fp32_fp32_Accfloat_1_1_cC1_dC1_srcVec1_fltVec4_4_TP3_TQ8_C2_R1_S1_U1_V1 Tactic: 0xbc130e9bbb26c09e Time: 0.0523627
[11/18/2024-12:09:45] [V] [TRT] Tactic Name: sm50_xmma_conv_fprop_fused_conv_act_fp32_NCHW_fp32_NCHW_KCRS_fp32_fp32_fp32_Accfloat_1_1_cC1_dC1_srcVec4_fltVec1_1_TP7_TQ1_C1_R1_S1_U1_V1 Tactic: 0x46094dd94e60f58a Time: 0.0223242
[11/18/2024-12:09:45] [V] [TRT] Tactic Name: sm50_xmma_conv_fprop_fused_conv_act_fp32_NCHW_fp32_NCHW_KCRS_fp32_fp32_fp32_Accfloat_1_1_cC1_dC1_srcVec4_fltVec1_1_TP4_TQ4_C2_R1_S1_U1_V1 Tactic: 0x5df694d12c46ef44 Time: 0.016547
[11/18/2024-12:09:45] [V] [TRT] Tactic Name: sm50_xmma_conv_fprop_fused_conv_act_fp32_NCHW_fp32_NCHW_KCRS_fp32_fp32_fp32_Accfloat_1_1_cC1_dC1_srcVec4_fltVec1_1_TP4_TQ7_C4_R1_S1_U1_V1 Tactic: 0x95559a386f1ab48c Time: 0.0138822
[11/18/2024-12:09:45] [V] [TRT] Tactic Name: sm50_xmma_conv_fprop_fused_conv_act_fp32_NCHW_fp32_NCHW_KCRS_fp32_fp32_fp32_Accfloat_1_1_cC1_dC1_srcVec2_fltVec2_2_TP8_TQ2_C8_R1_S1_U1_V1 Tactic: 0x84b1c619b722ac50 Time: 0.0134184
[11/18/2024-12:09:45] [V] [TRT] Tactic Name: sm50_xmma_conv_fprop_fused_conv_act_fp32_NCHW_fp32_NCHW_KCRS_fp32_fp32_fp32_Accfloat_1_1_cC1_dC1_srcVec1_fltVec4_4_TP4_TQ5_C8_R1_S1_U1_V1 Tactic: 0x80a5d7e9c9c4b8ce Time: 0.01866
[11/18/2024-12:09:45] [V] [TRT] Tactic Name: sm50_xmma_conv_fprop_fused_conv_act_fp32_NCHW_fp32_NCHW_KCRS_fp32_fp32_fp32_Accfloat_1_1_cC1_dC1_srcVec2_fltVec2_2_TP2_TQ8_C4_R1_S1_U1_V1 Tactic: 0x269b010715e657e8 Time: 0.0132975
[11/18/2024-12:09:45] [V] [TRT] Tactic Name: sm50_xmma_conv_fprop_fused_conv_act_fp32_NCHW_fp32_NCHW_KCRS_fp32_fp32_fp32_Accfloat_1_1_cC1_dC1_srcVec4_fltVec1_1_TP4_TQ8_C1_R1_S1_U1_V1 Tactic: 0xd646964a96ca001d Time: 0.0393189
[11/18/2024-12:09:45] [V] [TRT] Tactic Name: sm50_xmma_conv_fprop_fused_conv_act_fp32_NCHW_fp32_NCHW_KCRS_fp32_fp32_fp32_Accfloat_1_1_cC1_dC1_srcVec4_fltVec1_1_TP4_TQ7_C8_R1_S1_U1_V1 Tactic: 0x606e22cd0b28a04e Time: 0.0112883
[11/18/2024-12:09:45] [V] [TRT] Tactic Name: sm50_xmma_conv_fprop_fused_conv_act_fp32_NCHW_fp32_NCHW_KCRS_fp32_fp32_fp32_Accfloat_1_1_cC1_dC1_srcVec2_fltVec2_2_TP3_TQ10_C8_R1_S1_U1_V1 Tactic: 0x06122dede8a04ac8 Time: 0.0131836
[11/18/2024-12:09:45] [V] [TRT] Tactic Name: sm50_xmma_conv_fprop_fused_conv_act_fp32_NCHW_fp32_NCHW_KCRS_fp32_fp32_fp32_Accfloat_1_1_cC1_dC1_srcVec4_fltVec1_1_TP5_TQ5_C2_R1_S1_U1_V1 Tactic: 0x55214d4ab35e0b9d Time: 0.0203617
[11/18/2024-12:09:45] [V] [TRT] Tactic Name: sm50_xmma_conv_fprop_fused_conv_act_fp32_NCHW_fp32_NCHW_KCRS_fp32_fp32_fp32_Accfloat_1_1_cC1_dC1_srcVec2_fltVec2_2_TP2_TQ7_C2_R1_S1_U1_V1 Tactic: 0x91aab4dd62bd690b Time: 0.0223386
[11/18/2024-12:09:45] [V] [TRT] Tactic Name: sm50_xmma_conv_fprop_fused_conv_act_fp32_NCHW_fp32_NCHW_KCRS_fp32_fp32_fp32_Accfloat_1_1_cC1_dC1_srcVec4_fltVec1_1_TP7_TQ4_C4_R1_S1_U1_V1 Tactic: 0x8c2df094ce3399e7 Time: 0.0172058
[11/18/2024-12:09:45] [V] [TRT] Tactic Name: sm50_xmma_conv_fprop_fused_conv_act_fp32_NCHW_fp32_NCHW_KCRS_fp32_fp32_fp32_Accfloat_1_1_cC1_dC1_srcVec2_fltVec2_2_TP4_TQ4_C2_R1_S1_U1_V1 Tactic: 0xe7c1b91b9c2edfa3 Time: 0.0233306
[11/18/2024-12:09:45] [V] [TRT] Tactic Name: sm70_xmma_fprop_implicit_gemm_indexed_f32f32_f32f32_f32_nchwkcrs_nchw_tilesize128x16x8_stage1_warpsize4x1x1_g1_ffma_aligna4_alignc4 Tactic: 0x65d82d184f452332 Time: 0.0443897
[11/18/2024-12:09:45] [V] [TRT] Tactic Name: sm50_xmma_conv_fprop_fused_conv_act_fp32_NCHW_fp32_NCHW_KCRS_fp32_fp32_fp32_Accfloat_1_1_cC1_dC1_srcVec2_fltVec2_2_TP3_TQ9_C8_R1_S1_U1_V1 Tactic: 0xdb776069eecca7f3 Time: 0.0125989
[11/18/2024-12:09:45] [V] [TRT] Tactic Name: sm50_xmma_conv_fprop_fused_conv_act_fp32_NCHW_fp32_NCHW_KCRS_fp32_fp32_fp32_Accfloat_1_1_cC1_dC1_srcVec2_fltVec1_1_TP3_TQ10_C2_R1_S1_U1_V1 Tactic: 0xf119544b988c92ed Time: 0.0262979
[11/18/2024-12:09:45] [V] [TRT] Tactic Name: sm50_xmma_conv_fprop_fused_conv_act_fp32_NCHW_fp32_NCHW_KCRS_fp32_fp32_fp32_Accfloat_1_1_cC1_dC1_srcVec2_fltVec2_2_TP4_TQ7_C4_R1_S1_U1_V1 Tactic: 0x2f62b7f2df72846b Time: 0.016477
[11/18/2024-12:09:45] [V] [TRT] Tactic Name: sm50_xmma_conv_fprop_fused_conv_act_fp32_NCHW_fp32_NCHW_KCRS_fp32_fp32_fp32_Accfloat_1_1_cC1_dC1_srcVec1_fltVec4_4_TP2_TQ7_C4_R1_S1_U1_V1 Tactic: 0xe3a8b64d995c2040 Time: 0.0223974
[11/18/2024-12:09:45] [V] [TRT] Tactic Name: sm50_xmma_conv_fprop_fused_conv_act_fp32_NCHW_fp32_NCHW_KCRS_fp32_fp32_fp32_Accfloat_1_1_cC1_dC1_srcVec1_fltVec4_4_TP3_TQ7_C8_R1_S1_U1_V1 Tactic: 0xfe1903b4a84feabf Time: 0.0171784
[11/18/2024-12:09:45] [V] [TRT] Tactic Name: sm50_xmma_conv_fprop_fused_conv_act_fp32_NCHW_fp32_NCHW_KCRS_fp32_fp32_fp32_Accfloat_1_1_cC1_dC1_srcVec4_fltVec1_1_TP5_TQ5_C4_R1_S1_U1_V1 Tactic: 0x2fbc9130014701fc Time: 0.0123768
[11/18/2024-12:09:45] [V] [TRT] Tactic Name: volta_scudnn_128x64_relu_small_nn_v1 Tactic: 0x5e7d1125e7896624 Time: 0.0366697
[11/18/2024-12:09:45] [V] [TRT] Tactic Name: sm70_xmma_fprop_implicit_gemm_f32f32_f32f32_f32_nchwkcrs_nchw_tilesize128x256x8_stage1_warpsize2x4x1_g1_ffma_aligna4_alignc4 Tactic: 0xd2aa21bfe2167c0c Time: 0.118075
[11/18/2024-12:09:45] [V] [TRT] Tactic Name: sm50_xmma_conv_fprop_fused_conv_act_fp32_NCHW_fp32_NCHW_KCRS_fp32_fp32_fp32_Accfloat_1_1_cC1_dC1_srcVec4_fltVec1_1_TP1_TQ8_C2_R1_S1_U1_V1 Tactic: 0x4d77488847fb11ac Time: 0.0129718
[11/18/2024-12:09:45] [V] [TRT] Tactic Name: sm50_xmma_conv_fprop_fused_conv_act_fp32_NCHW_fp32_NCHW_KCRS_fp32_fp32_fp32_Accfloat_1_1_cC1_dC1_srcVec4_fltVec1_1_TP4_TQ5_C2_R1_S1_U1_V1 Tactic: 0xbdab4046e67fd5a0 Time: 0.0190486
[11/18/2024-12:09:45] [V] [TRT] Tactic Name: sm70_xmma_fprop_implicit_gemm_f32f32_f32f32_f32_nchwkcrs_nchw_tilesize64x64x8_stage1_warpsize1x4x1_g1_ffma_aligna4_alignc4 Tactic: 0xe40b38338a3a7d7e Time: 0.0210469
[11/18/2024-12:09:45] [V] [TRT] Tactic Name: sm50_xmma_conv_fprop_fused_conv_act_fp32_NCHW_fp32_NCHW_KCRS_fp32_fp32_fp32_Accfloat_1_1_cC1_dC1_srcVec2_fltVec2_2_TP3_TQ10_C2_R1_S1_U1_V1 Tactic: 0x89b449623e8b546b Time: 0.0331675
[11/18/2024-12:09:45] [V] [TRT] Tactic Name: sm70_xmma_fprop_implicit_gemm_f32f32_f32f32_f32_nchwkcrs_nchw_tilesize64x128x8_stage1_warpsize1x4x1_g1_ffma_aligna4_alignc4 Tactic: 0xd1338f4b38d341e2 Time: 0.0347218
[11/18/2024-12:09:45] [V] [TRT] Tactic Name: sm50_xmma_conv_fprop_fused_conv_act_fp32_NCHW_fp32_NCHW_KCRS_fp32_fp32_fp32_Accfloat_1_1_cC1_dC1_srcVec2_fltVec2_2_TP2_TQ9_C1_R1_S1_U1_V1 Tactic: 0x4879b042e34ded1f Time: 0.0465394
[11/18/2024-12:09:45] [V] [TRT] Tactic Name: sm50_xmma_conv_fprop_fused_conv_act_fp32_NCHW_fp32_NCHW_KCRS_fp32_fp32_fp32_Accfloat_1_1_cC1_dC1_srcVec2_fltVec1_1_TP4_TQ8_C8_R1_S1_U1_V1 Tactic: 0x4f9a95a9a8862c25 Time: 0.0121173
[11/18/2024-12:09:45] [V] [TRT] Tactic Name: sm50_xmma_conv_fprop_fused_conv_act_fp32_NCHW_fp32_NCHW_KCRS_fp32_fp32_fp32_Accfloat_1_1_cC1_dC1_srcVec2_fltVec2_2_TP5_TQ5_C1_R1_S1_U1_V1 Tactic: 0x1b34d9288dbdb108 Time: 0.0538743
[11/18/2024-12:09:45] [V] [TRT] Tactic Name: sm70_xmma_fprop_implicit_gemm_f32f32_f32f32_f32_nchwkcrs_nchw_tilesize128x128x8_stage1_warpsize2x2x1_g1_ffma_aligna4_alignc4 Tactic: 0xac49795b871b0d29 Time: 0.0736
[11/18/2024-12:09:45] [V] [TRT] Tactic Name: sm70_xmma_fprop_implicit_gemm_f32f32_f32f32_f32_nchwkcrs_nchw_tilesize128x64x8_stage1_warpsize2x2x1_g1_ffma_aligna4_alignc4 Tactic: 0x994f5b723e2d80da Time: 0.0374251
[11/18/2024-12:09:45] [V] [TRT] Tactic Name: sm70_xmma_fprop_implicit_gemm_indexed_f32f32_f32f32_f32_nchwkcrs_nchw_tilesize128x32x8_stage1_warpsize2x2x1_g1_ffma_aligna4_alignc4 Tactic: 0x8c4f6360145d6a1f Time: 0.035848
[11/18/2024-12:09:45] [V] [TRT] Tactic Name: sm70_xmma_fprop_implicit_gemm_f32f32_f32f32_f32_nchwkcrs_nchw_tilesize64x64x8_stage1_warpsize1x4x1_g1_ffma_t1r1s1_aligna4_alignc4 Tactic: 0xa3cd285aae791bdd Time: 0.0212297
[11/18/2024-12:09:45] [V] [TRT] Tactic Name: sm50_xmma_conv_fprop_fused_conv_act_fp32_NCHW_fp32_NCHW_KCRS_fp32_fp32_fp32_Accfloat_1_1_cC1_dC1_srcVec4_fltVec1_1_TP1_TQ7_C1_R1_S1_U1_V1 Tactic: 0x74f998800c32af5c Time: 0.0214354
[11/18/2024-12:09:45] [V] [TRT] Tactic Name: sm50_xmma_conv_fprop_fused_conv_act_fp32_NCHW_fp32_NCHW_KCRS_fp32_fp32_fp32_Accfloat_1_1_cC1_dC1_srcVec1_fltVec4_4_TP3_TQ7_C4_R1_S1_U1_V1 Tactic: 0x0b22bb41cc7dfe7d Time: 0.0253455
[11/18/2024-12:09:45] [V] [TRT] Tactic Name: sm70_xmma_fprop_implicit_gemm_indexed_f32f32_f32f32_f32_nchwkcrs_nchw_tilesize64x64x8_stage1_warpsize1x4x1_g1_ffma_aligna4_alignc4 Tactic: 0x8d5c64a52fab02c9 Time: 0.0261333
[11/18/2024-12:09:45] [V] [TRT] Tactic Name: sm50_xmma_conv_fprop_fused_conv_act_fp32_NCHW_fp32_NCHW_KCRS_fp32_fp32_fp32_Accfloat_1_1_cC1_dC1_srcVec4_fltVec1_1_TP2_TQ7_C2_R1_S1_U1_V1 Tactic: 0x2b9d9917d2d559ec Time: 0.0151872
[11/18/2024-12:09:45] [V] [TRT] Tactic Name: sm50_xmma_conv_fprop_fused_conv_act_fp32_NCHW_fp32_NCHW_KCRS_fp32_fp32_fp32_Accfloat_1_1_cC1_dC1_srcVec2_fltVec2_2_TP7_TQ2_C4_R1_S1_U1_V1 Tactic: 0xc0bfd75233df14d7 Time: 0.0138161
[11/18/2024-12:09:45] [V] [TRT] Tactic Name: volta_scudnn_128x32_relu_interior_nn_v1 Tactic: 0x25eed4cfa195d49d Time: 0.0403897
[11/18/2024-12:09:45] [V] [TRT] Tactic Name: volta_scudnn_128x64_relu_interior_nn_v1 Tactic: 0x7e29bdfccd92c42c Time: 0.0358366
[11/18/2024-12:09:45] [V] [TRT] Tactic Name: sm70_xmma_fprop_implicit_gemm_f32f32_f32f32_f32_nchwkcrs_nchw_tilesize128x32x8_stage1_warpsize2x2x1_g1_ffma_simple_t1r1s1_aligna4_alignc4 Tactic: 0xbe8434a96b14e8b2 Time: 0.0278857
[11/18/2024-12:09:45] [V] [TRT] Tactic Name: sm70_xmma_fprop_implicit_gemm_f32f32_f32f32_f32_nchwkcrs_nchw_tilesize64x64x8_stage1_warpsize1x4x1_g1_ffma_simple_t1r1s1_aligna4_alignc4 Tactic: 0x5193693bc0732c65 Time: 0.0222472
[11/18/2024-12:09:45] [V] [TRT] Tactic Name: sm50_xmma_conv_fprop_fused_conv_act_fp32_NCHW_fp32_NCHW_KCRS_fp32_fp32_fp32_Accfloat_1_1_cC1_dC1_srcVec4_fltVec1_1_TP2_TQ7_C4_R1_S1_U1_V1 Tactic: 0x5100456d60cc538d Time: 0.00948029
[11/18/2024-12:09:45] [V] [TRT] Tactic Name: sm50_xmma_conv_fprop_fused_conv_act_fp32_NCHW_fp32_NCHW_KCRS_fp32_fp32_fp32_Accfloat_1_1_cC1_dC1_srcVec4_fltVec1_1_TP3_TQ9_C4_R1_S1_U1_V1 Tactic: 0x947bf5563a9683d6 Time: 0.012803
[11/18/2024-12:09:45] [V] [TRT] Tactic Name: sm50_xmma_conv_fprop_fused_conv_act_fp32_NCHW_fp32_NCHW_KCRS_fp32_fp32_fp32_Accfloat_1_1_cC1_dC1_srcVec2_fltVec2_2_TP2_TQ9_C4_R1_S1_U1_V1 Tactic: 0xc6c6d590dfdf6d0c Time: 0.0141839
[11/18/2024-12:09:45] [V] [TRT] Tactic Name: sm50_xmma_conv_fprop_fused_conv_act_fp32_NCHW_fp32_NCHW_KCRS_fp32_fp32_fp32_Accfloat_1_1_cC1_dC1_srcVec2_fltVec2_2_TP2_TQ7_C1_R1_S1_U1_V1 Tactic: 0x65880d75ec36e379 Time: 0.0435806
[11/18/2024-12:09:45] [V] [TRT] Tactic Name: sm70_xmma_fprop_implicit_gemm_f32f32_f32f32_f32_nchwkcrs_nchw_tilesize64x128x8_stage1_warpsize1x4x1_g1_ffma_simple_t1r1s1_aligna4_alignc4 Tactic: 0xa0dcf7c2b333d150 Time: 0.0357486
[11/18/2024-12:09:45] [V] [TRT] Tactic Name: sm50_xmma_conv_fprop_fused_conv_act_fp32_NCHW_fp32_NCHW_KCRS_fp32_fp32_fp32_Accfloat_1_1_cC1_dC1_srcVec2_fltVec2_2_TP1_TQ7_C1_R1_S1_U1_V1 Tactic: 0xceceb54abc5a9fbb Time: 0.035691
[11/18/2024-12:09:45] [V] [TRT] Tactic Name: sm50_xmma_conv_fprop_fused_conv_act_fp32_NCHW_fp32_NCHW_KCRS_fp32_fp32_fp32_Accfloat_1_1_cC1_dC1_srcVec1_fltVec1_1_TP7_TQ4_C1_R1_S1_U1_V1 Tactic: 0x588a737570bcf22b Time: 0.0670888
[11/18/2024-12:09:45] [V] [TRT] Tactic Name: sm50_xmma_conv_fprop_fused_conv_act_fp32_NCHW_fp32_NCHW_KCRS_fp32_fp32_fp32_Accfloat_1_1_cC1_dC1_srcVec1_fltVec4_4_TP3_TQ10_C4_R1_S1_U1_V1 Tactic: 0x0b33f9e893e376e6 Time: 0.0294802
[11/18/2024-12:09:45] [V] [TRT] Tactic Name: sm50_xmma_conv_fprop_fused_conv_act_fp32_NCHW_fp32_NCHW_KCRS_fp32_fp32_fp32_Accfloat_1_1_cC1_dC1_srcVec2_fltVec2_2_TP4_TQ7_C8_R1_S1_U1_V1 Tactic: 0xda590f07bb4090a9 Time: 0.0126815
[11/18/2024-12:09:45] [V] [TRT] Tactic Name: sm50_xmma_conv_fprop_fused_conv_act_fp32_NCHW_fp32_NCHW_KCRS_fp32_fp32_fp32_Accfloat_1_1_cC1_dC1_srcVec2_fltVec2_2_TP7_TQ4_C8_R1_S1_U1_V1 Tactic: 0xc32165ab1a69bdc2 Time: 0.0136628
[11/18/2024-12:09:45] [V] [TRT] Tactic Name: sm50_xmma_conv_fprop_fused_conv_act_fp32_NCHW_fp32_NCHW_KCRS_fp32_fp32_fp32_Accfloat_1_1_cC1_dC1_srcVec2_fltVec2_2_TP2_TQ8_C2_R1_S1_U1_V1 Tactic: 0x5c06dd7da7ff5d89 Time: 0.0232379
[11/18/2024-12:09:45] [V] [TRT] Tactic Name: sm50_xmma_conv_fprop_fused_conv_act_fp32_NCHW_fp32_NCHW_KCRS_fp32_fp32_fp32_Accfloat_1_1_cC1_dC1_srcVec2_fltVec2_2_TP2_TQ8_C8_R1_S1_U1_V1 Tactic: 0xd3a0b9f271d4432a Time: 0.00960549
[11/18/2024-12:09:45] [V] [TRT] Tactic Name: sm50_xmma_conv_fprop_fused_conv_act_fp32_NCHW_fp32_NCHW_KCRS_fp32_fp32_fp32_Accfloat_1_1_cC1_dC1_srcVec1_fltVec1_1_TP3_TQ10_C8_R1_S1_U1_V1 Tactic: 0x77ff66671dd929ae Time: 0.0129204
[11/18/2024-12:09:45] [V] [TRT] Tactic Name: sm50_xmma_conv_fprop_fused_conv_act_fp32_NCHW_fp32_NCHW_KCRS_fp32_fp32_fp32_Accfloat_1_1_cC1_dC1_srcVec1_fltVec4_4_TP6_TQ5_C2_R1_S1_U1_V1 Tactic: 0x4ccf06551aa20492 Time: 0.0550095
[11/18/2024-12:09:45] [V] [TRT] Tactic Name: sm50_xmma_conv_fprop_fused_conv_act_fp32_NCHW_fp32_NCHW_KCRS_fp32_fp32_fp32_Accfloat_1_1_cC1_dC1_srcVec2_fltVec2_2_TP2_TQ10_C1_R1_S1_U1_V1 Tactic: 0xc48d91bc4c36e826 Time: 0.048445
[11/18/2024-12:09:45] [V] [TRT] Tactic Name: sm50_xmma_conv_fprop_fused_conv_act_fp32_NCHW_fp32_NCHW_KCRS_fp32_fp32_fp32_Accfloat_1_1_cC1_dC1_srcVec2_fltVec2_2_TP2_TQ9_C2_R1_S1_U1_V1 Tactic: 0xbc5b09ea6dc6676d Time: 0.0256602
[11/18/2024-12:09:45] [V] [TRT] Tactic Name: sm50_xmma_conv_fprop_fused_conv_act_fp32_NCHW_fp32_NCHW_KCRS_fp32_fp32_fp32_Accfloat_1_1_cC1_dC1_srcVec1_fltVec4_4_TP5_TQ5_C1_R1_S1_U1_V1 Tactic: 0x13ab07c2c445f222 Time: 0.0996823
[11/18/2024-12:09:45] [V] [TRT] Tactic Name: sm50_xmma_conv_fprop_fused_conv_act_fp32_NCHW_fp32_NCHW_KCRS_fp32_fp32_fp32_Accfloat_1_1_cC1_dC1_srcVec2_fltVec2_2_TP3_TQ8_C1_R1_S1_U1_V1 Tactic: 0x40ae69d97c5509c6 Time: 0.0522697
[11/18/2024-12:09:45] [V] [TRT] Tactic Name: sm50_xmma_conv_fprop_fused_conv_act_fp32_NCHW_fp32_NCHW_KCRS_fp32_fp32_fp32_Accfloat_1_1_cC1_dC1_srcVec4_fltVec1_1_TP4_TQ7_C2_R1_S1_U1_V1 Tactic: 0xefc84642dd03beed Time: 0.0232633
[11/18/2024-12:09:45] [V] [TRT] Tactic Name: sm50_xmma_conv_fprop_fused_conv_act_fp32_NCHW_fp32_NCHW_KCRS_fp32_fp32_fp32_Accfloat_1_1_cC1_dC1_srcVec2_fltVec2_2_TP4_TQ4_C8_R1_S1_U1_V1 Tactic: 0x6867dd944a05c100 Time: 0.0101239
[11/18/2024-12:09:45] [V] [TRT] Tactic Name: sm50_xmma_conv_fprop_fused_conv_act_fp32_NCHW_fp32_NCHW_KCRS_fp32_fp32_fp32_Accfloat_1_1_cC1_dC1_srcVec1_fltVec4_4_TP4_TQ7_C4_R1_S1_U1_V1 Tactic: 0x27fd6918968ac741 Time: 0.0285196
[11/18/2024-12:09:45] [V] [TRT] Tactic Name: sm50_xmma_conv_fprop_fused_conv_act_fp32_NCHW_fp32_NCHW_KCRS_fp32_fp32_fp32_Accfloat_1_1_cC1_dC1_srcVec1_fltVec2_2_TP3_TQ7_C8_R1_S1_U1_V1 Tactic: 0x4ec6e5a90546faa3 Time: 0.0132792
[11/18/2024-12:09:45] [V] [TRT] Tactic Name: sm50_xmma_conv_fprop_fused_conv_act_fp32_NCHW_fp32_NCHW_KCRS_fp32_fp32_fp32_Accfloat_1_1_cC1_dC1_srcVec4_fltVec1_1_TP2_TQ8_C2_R1_S1_U1_V1 Tactic: 0xe631f0b717976d6e Time: 0.0160681
[11/18/2024-12:09:45] [V] [TRT] /gnn/layers.0/attn/proj.1_1/Conv || /gnn/layers.0/attn/proj.0_1/Conv (CaskConvolution[0x80000009]) profiling completed in 0.208829 seconds. Fastest Tactic: 0x5100456d60cc538d Time: 0.00948029
[11/18/2024-12:09:45] [V] [TRT] Skipping CaskFlattenConvolution: No valid tactics for /gnn/layers.0/attn/proj.1_1/Conv || /gnn/layers.0/attn/proj.0_1/Conv
[11/18/2024-12:09:45] [V] [TRT] >>>>>>>>>>>>>>> Chose Runner Type: CaskConvolution Tactic: 0x5100456d60cc538d
[11/18/2024-12:09:45] [V] [TRT] *************** Autotuning format combination: Float(1280,1,1280,256) -> Float(2560,1,2560,512) ***************
[11/18/2024-12:09:45] [V] [TRT] --------------- Timing Runner: /gnn/layers.0/attn/proj.1_1/Conv || /gnn/layers.0/attn/proj.0_1/Conv (CaskConvolution[0x80000009])
[11/18/2024-12:09:45] [V] [TRT] Tactic Name: sm70_xmma_fprop_implicit_gemm_indexed_f32f32_f32f32_f32_nhwckrsc_nhwc_tilesize128x16x8_stage1_warpsize4x1x1_g1_ffma_aligna4_alignc4 Tactic: 0x6aaac747558eb868 Time: 0.0391463
[11/18/2024-12:09:45] [V] [TRT] Tactic Name: sm70_xmma_fprop_implicit_gemm_f32f32_f32f32_f32_nhwckrsc_nhwc_tilesize64x16x16_stage1_warpsize1x1x1_g1_ffma_simple_t1r1s1_aligna4_alignc4 Tactic: 0x53056a2984bcd5bc Time: 0.0220963
[11/18/2024-12:09:45] [V] [TRT] Tactic Name: sm70_xmma_fprop_implicit_gemm_f32f32_f32f32_f32_nhwckrsc_nhwc_tilesize128x64x8_stage1_warpsize2x2x1_g1_ffma_simple_t1r1s1_aligna4_alignc4 Tactic: 0xe957dcfcec24ec5d Time: 0.0351936
[11/18/2024-12:09:45] [V] [TRT] Tactic Name: sm70_xmma_fprop_implicit_gemm_f32f32_f32f32_f32_nhwckrsc_nhwc_tilesize64x128x8_stage1_warpsize1x4x1_g1_ffma_simple_t1r1s1_aligna4_alignc4 Tactic: 0xfbba95cf52891795 Time: 0.0347758
[11/18/2024-12:09:45] [V] [TRT] Tactic Name: sm70_xmma_fprop_implicit_gemm_f32f32_f32f32_f32_nhwckrsc_nhwc_tilesize128x64x8_stage1_warpsize2x2x1_g1_ffma_aligna4_alignc4 Tactic: 0x963db12d24e61b80 Time: 0.0382903
[11/18/2024-12:09:45] [V] [TRT] Tactic Name: sm70_xmma_fprop_implicit_gemm_f32f32_f32f32_f32_nhwckrsc_nhwc_tilesize64x16x16_stage1_warpsize1x1x1_g1_ffma_aligna4_alignc4 Tactic: 0x3f904b355d9ca8e6 Time: 0.0270933
[11/18/2024-12:09:45] [V] [TRT] Tactic Name: sm70_xmma_fprop_implicit_gemm_f32f32_f32f32_f32_nhwckrsc_nhwc_tilesize128x32x8_stage1_warpsize2x2x1_g1_ffma_simple_t1r1s1_aligna4_alignc4 Tactic: 0xe5e256a48aae2e77 Time: 0.024333
[11/18/2024-12:09:45] [V] [TRT] Tactic Name: sm70_xmma_fprop_implicit_gemm_f32f32_f32f32_f32_nhwckrsc_nhwc_tilesize64x64x8_stage1_warpsize1x4x1_g1_ffma_aligna4_alignc4 Tactic: 0x2595402367cdee5c Time: 0.0209365
[11/18/2024-12:09:45] [V] [TRT] Tactic Name: sm70_xmma_fprop_implicit_gemm_f32f32_f32f32_f32_nhwckrsc_nhwc_tilesize256x128x8_stage1_warpsize2x4x1_g1_ffma_aligna4_alignc4 Tactic: 0x0447933cc2be855a Time: 0.119785
[11/18/2024-12:09:45] [V] [TRT] Tactic Name: sm70_xmma_fprop_implicit_gemm_f32f32_f32f32_f32_nhwckrsc_nhwc_tilesize64x64x8_stage1_warpsize1x4x1_g1_ffma_simple_t1r1s1_aligna4_alignc4 Tactic: 0xded29d328f8f7228 Time: 0.020482
[11/18/2024-12:09:45] [V] [TRT] Tactic Name: sm70_xmma_fprop_implicit_gemm_f32f32_f32f32_f32_nhwckrsc_nhwc_tilesize64x128x8_stage1_warpsize1x4x1_g1_ffma_t1r1s1_aligna4_alignc4 Tactic: 0xa79cf41de521f476 Time: 0.0355255
[11/18/2024-12:09:45] [V] [TRT] Tactic Name: sm70_xmma_fprop_implicit_gemm_f32f32_f32f32_f32_nhwckrsc_nhwc_tilesize64x32x32_stage1_warpsize1x1x1_g1_ffma_simple_t1r1s1_aligna4_alignc4 Tactic: 0xa1ca175f00ddac25 Time: 0.0853006
[11/18/2024-12:09:45] [V] [TRT] Tactic Name: sm70_xmma_fprop_implicit_gemm_indexed_f32f32_f32f32_f32_nhwckrsc_nhwc_tilesize128x32x8_stage1_warpsize2x2x1_g1_ffma_aligna4_alignc4 Tactic: 0x833d893f0e96f145 Time: 0.0273653
[11/18/2024-12:09:45] [V] [TRT] Tactic Name: sm70_xmma_fprop_implicit_gemm_f32f32_f32f32_f32_nhwckrsc_nhwc_tilesize128x16x8_stage1_warpsize4x1x1_g1_ffma_aligna4_alignc4 Tactic: 0x19799dabb3912d89 Time: 0.0334775
[11/18/2024-12:09:45] [V] [TRT] Tactic Name: sm70_xmma_fprop_implicit_gemm_f32f32_f32f32_f32_nhwckrsc_nhwc_tilesize64x32x32_stage1_warpsize1x1x1_g1_ffma_aligna4_alignc4 Tactic: 0xdb73e25ae4006f74 Time: 0.122736
[11/18/2024-12:09:45] [V] [TRT] Tactic Name: sm70_xmma_fprop_implicit_gemm_f32f32_f32f32_f32_nhwckrsc_nhwc_tilesize64x128x8_stage1_warpsize1x4x1_g1_ffma_aligna4_alignc4 Tactic: 0xde4165142218dab8 Time: 0.036256
[11/18/2024-12:09:45] [V] [TRT] Tactic Name: sm70_xmma_fprop_implicit_gemm_f32f32_f32f32_f32_nhwckrsc_nhwc_tilesize64x64x8_stage1_warpsize1x4x1_g1_ffma_t1r1s1_aligna4_alignc4 Tactic: 0x704db0897ce9340d Time: 0.0204121
[11/18/2024-12:09:45] [V] [TRT] /gnn/layers.0/attn/proj.1_1/Conv || /gnn/layers.0/attn/proj.0_1/Conv (CaskConvolution[0x80000009]) profiling completed in 0.0367083 seconds. Fastest Tactic: 0x704db0897ce9340d Time: 0.0204121
[11/18/2024-12:09:45] [V] [TRT] /gnn/layers.0/attn/proj.1_1/Conv || /gnn/layers.0/attn/proj.0_1/Conv: 60 available tactics, 8 unparsable, 26 pruned, 34 remaining after tactic pruning.
[11/18/2024-12:09:45] [V] [TRT] --------------- Timing Runner: /gnn/layers.0/attn/proj.1_1/Conv || /gnn/layers.0/attn/proj.0_1/Conv (CaskGemmConvolution[0x8000002e])
[11/18/2024-12:09:45] [V] [TRT] Tactic Name: sm50_xmma_cublas_smallN_NN_f32f32_f32_f32_nn_n_thread_count256threads_per_row8b_elems_per_thread2bias_or_reluTrue numSplitK: 1 numBuffers: 0 numKernels: 1 Tactic: 0x0000000000020315 Time: 0.00575726
[11/18/2024-12:09:45] [V] [TRT] Tactic Name: sm50_xmma_cublas_smallN_NN_f32f32_f32_f32_nn_n_thread_count256threads_per_row8b_elems_per_thread2bias_or_reluFalse numSplitK: 1 numBuffers: 0 numKernels: 1 Tactic: 0x0000000000020317 Time: 0.00561477
[11/18/2024-12:09:45] [V] [TRT] Tactic Name: sm50_xmma_cublas_smallN_NN_f32f32_f32_f32_nn_n_thread_count128threads_per_row2b_elems_per_thread4bias_or_reluFalse numSplitK: 1 numBuffers: 0 numKernels: 1 Tactic: 0x0000000000020818 Time: 0.00776878
[11/18/2024-12:09:45] [V] [TRT] Tactic Name: sm70_xmma_gemm_as_conv1x1_f32f32_f32_f32_tn_n_simt_small_batch_bias_relu numSplitK: 1 numBuffers: 0 numKernels: 1 Tactic: 0x000000000002042c Time: 0.00567965
[11/18/2024-12:09:45] [V] [TRT] Tactic Name: sm50_xmma_cublas_smallN_NN_f32f32_f32_f32_nn_n_thread_count256threads_per_row16b_elems_per_thread2bias_or_reluTrue numSplitK: 1 numBuffers: 0 numKernels: 1 Tactic: 0x00000000000207c9 Time: 0.00428195
[11/18/2024-12:09:45] [V] [TRT] Tactic Name: sm50_xmma_cublas_smallN_TN_f32f32_f32_f32_tn_n_cols_per_thread6cols_per_thread_bb7exact_colFalse numSplitK: 1 numBuffers: 0 numKernels: 1 Tactic: 0x0000000000020442 Time: 0.00599467
[11/18/2024-12:09:45] [V] [TRT] Tactic Name: sm50_xmma_cublas_smallN_NN_f32f32_f32_f32_nn_n_thread_count128threads_per_row2b_elems_per_thread4bias_or_reluTrue numSplitK: 1 numBuffers: 0 numKernels: 1 Tactic: 0x000000000002048c Time: 0.00620686
[11/18/2024-12:09:45] [V] [TRT] Tactic Name: sm50_xmma_cublas_smallN_NN_f32f32_f32_f32_nn_n_thread_count256threads_per_row16b_elems_per_thread2bias_or_reluFalse numSplitK: 1 numBuffers: 0 numKernels: 1 Tactic: 0x0000000000020624 Time: 0.00595182
[11/18/2024-12:09:45] [V] [TRT] Tactic Name: turing_sgemm_32x32_sliced1x4_nn_v1 numSplitK: 1 numBuffers: 0 numKernels: 1 Tactic: 0x0000000000020852 Time: 0.00905857
[11/18/2024-12:09:45] [V] [TRT] Tactic Name: turing_sgemm_32x32_sliced1x4_relu_tn_v1 numSplitK: 1 numBuffers: 0 numKernels: 1 Tactic: 0x00000000000200b8 Time: 0.00835022
[11/18/2024-12:09:45] [V] [TRT] Tactic Name: volta_sgemm_32x32_sliced1x4_tn_v1 numSplitK: 1 numBuffers: 0 numKernels: 1 Tactic: 0x00000000000200a0 Time: 0.00981608
[11/18/2024-12:09:45] [V] [TRT] Tactic Name: volta_sgemm_32x32_sliced1x4_nn_v1 numSplitK: 1 numBuffers: 0 numKernels: 1 Tactic: 0x00000000000205fa Time: 0.00901229
[11/18/2024-12:09:45] [V] [TRT] Tactic Name: turing_sgemm_32x32_sliced1x4_tn_v1 numSplitK: 1 numBuffers: 0 numKernels: 1 Tactic: 0x0000000000020708 Time: 0.00991177
[11/18/2024-12:09:45] [V] [TRT] Tactic Name: turing_sgemm_32x32_sliced1x4_relu_nn_v1 numSplitK: 1 numBuffers: 0 numKernels: 1 Tactic: 0x0000000000020050 Time: 0.00748754
[11/18/2024-12:09:45] [V] [TRT] Tactic Name: volta_sgemm_64x32_sliced1x4_tn_v1 numSplitK: 1 numBuffers: 0 numKernels: 1 Tactic: 0x000000000002020e Time: 0.0108679
[11/18/2024-12:09:45] [V] [TRT] Tactic Name: turing_sgemm_64x32_sliced1x4_tn_v1 numSplitK: 1 numBuffers: 0 numKernels: 1 Tactic: 0x000000000002013f Time: 0.0107602
[11/18/2024-12:09:45] [V] [TRT] Tactic Name: turing_sgemm_64x32_sliced1x4_nn_v1 numSplitK: 1 numBuffers: 0 numKernels: 1 Tactic: 0x000000000002036b Time: 0.0101577
[11/18/2024-12:09:45] [V] [TRT] Tactic Name: turing_sgemm_64x32_sliced1x4_relu_tn_v1 numSplitK: 1 numBuffers: 0 numKernels: 1 Tactic: 0x00000000000203ee Time: 0.00928971
[11/18/2024-12:09:45] [V] [TRT] Tactic Name: turing_sgemm_64x32_sliced1x4_relu_nn_v1 numSplitK: 1 numBuffers: 0 numKernels: 1 Tactic: 0x00000000000207d3 Time: 0.00872659
[11/18/2024-12:09:45] [V] [TRT] Tactic Name: volta_sgemm_64x32_sliced1x4_nn_v1 numSplitK: 1 numBuffers: 0 numKernels: 1 Tactic: 0x0000000000020719 Time: 0.0101272
[11/18/2024-12:09:45] [V] [TRT] Tactic Name: turing_sgemm_64x32_sliced1x4_relu_nn_v1 numSplitK: 2 numBuffers: 1 numKernels: 1 Tactic: 0x00000000020407d3 Time: 0.00989196
[11/18/2024-12:09:45] [V] [TRT] Tactic Name: turing_sgemm_64x32_sliced1x4_relu_tn_v1 numSplitK: 2 numBuffers: 1 numKernels: 1 Tactic: 0x00000000020403ee Time: 0.0110164
[11/18/2024-12:09:45] [V] [TRT] Tactic Name: turing_sgemm_64x32_sliced1x4_nn_v1 numSplitK: 2 numBuffers: 1 numKernels: 1 Tactic: 0x000000000204036b Time: 0.0112573
[11/18/2024-12:09:45] [V] [TRT] Tactic Name: volta_sgemm_64x32_sliced1x4_nn_v1 numSplitK: 2 numBuffers: 1 numKernels: 1 Tactic: 0x0000000002040719 Time: 0.0112527
[11/18/2024-12:09:45] [V] [TRT] Tactic Name: turing_sgemm_64x32_sliced1x4_tn_v1 numSplitK: 2 numBuffers: 1 numKernels: 1 Tactic: 0x000000000204013f Time: 0.0121634
[11/18/2024-12:09:45] [V] [TRT] Tactic Name: volta_sgemm_64x32_sliced1x4_tn_v1 numSplitK: 2 numBuffers: 1 numKernels: 1 Tactic: 0x000000000204020e Time: 0.0122899
[11/18/2024-12:09:45] [V] [TRT] Tactic Name: turing_sgemm_32x32_sliced1x4_tn_v1 numSplitK: 2 numBuffers: 1 numKernels: 1 Tactic: 0x0000000002040708 Time: 0.0125181
[11/18/2024-12:09:45] [V] [TRT] Tactic Name: turing_sgemm_32x32_sliced1x4_nn_v1 numSplitK: 2 numBuffers: 1 numKernels: 1 Tactic: 0x0000000002040852 Time: 0.0115425
[11/18/2024-12:09:45] [V] [TRT] Tactic Name: volta_sgemm_32x32_sliced1x4_nn_v1 numSplitK: 2 numBuffers: 1 numKernels: 1 Tactic: 0x00000000020405fa Time: 0.0115559
[11/18/2024-12:09:45] [V] [TRT] Tactic Name: volta_sgemm_32x32_sliced1x4_tn_v1 numSplitK: 2 numBuffers: 1 numKernels: 1 Tactic: 0x00000000020400a0 Time: 0.012483
[11/18/2024-12:09:45] [V] [TRT] Tactic Name: turing_sgemm_32x32_sliced1x4_relu_tn_v1 numSplitK: 2 numBuffers: 1 numKernels: 1 Tactic: 0x00000000020400b8 Time: 0.0112819
[11/18/2024-12:09:45] [V] [TRT] Tactic Name: turing_sgemm_32x32_sliced1x4_relu_nn_v1 numSplitK: 2 numBuffers: 1 numKernels: 1 Tactic: 0x0000000002040050 Time: 0.010336
[11/18/2024-12:09:45] [V] [TRT] Tactic Name: volta_sgemm_128x32_sliced1x4_tn_v1 numSplitK: 2 numBuffers: 1 numKernels: 1 Tactic: 0x000000000204006f Time: 0.0144096
[11/18/2024-12:09:45] [V] [TRT] Tactic Name: turing_sgemm_128x32_sliced1x4_relu_nn_v1 numSplitK: 2 numBuffers: 1 numKernels: 1 Tactic: 0x0000000002040053 Time: 0.0126392
[11/18/2024-12:09:45] [V] [TRT] /gnn/layers.0/attn/proj.1_1/Conv || /gnn/layers.0/attn/proj.0_1/Conv (CaskGemmConvolution[0x8000002e]) profiling completed in 0.188009 seconds. Fastest Tactic: 0x00000000000207c9 Time: 0.00428195
[11/18/2024-12:09:45] [V] [TRT] Skipping CaskFlattenConvolution: No valid tactics for /gnn/layers.0/attn/proj.1_1/Conv || /gnn/layers.0/attn/proj.0_1/Conv
[11/18/2024-12:09:45] [V] [TRT] >>>>>>>>>>>>>>> Chose Runner Type: CaskGemmConvolution Tactic: 0x00000000000207c9
[11/18/2024-12:09:45] [V] [TRT] *************** Autotuning format combination: Float(320,1:4,320,64) -> Float(640,1:4,640,128) ***************
[11/18/2024-12:09:45] [V] [TRT] --------------- Timing Runner: /gnn/layers.0/attn/proj.1_1/Conv || /gnn/layers.0/attn/proj.0_1/Conv (CaskConvolution[0x80000009])
[11/18/2024-12:09:45] [V] [TRT] Tactic Name: volta_scudnn_128x64_sliced1x2_ldg4_relu_exp_small_nhwc_tn_v1 Tactic: 0x48f8d75aa348d22f Time: 0.0231295
[11/18/2024-12:09:45] [V] [TRT] Tactic Name: volta_scudnn_128x128_relu_exp_interior_nhwc_tn_v1 Tactic: 0xb90177ab6d659acd Time: 0.0397429
[11/18/2024-12:09:45] [V] [TRT] Tactic Name: volta_scudnn_128x64_sliced1x2_ldg4_relu_exp_interior_nhwc_tn_v1 Tactic: 0xf92663d88255134b Time: 0.0225189
[11/18/2024-12:09:45] [V] [TRT] Tactic Name: volta_scudnn_128x128_ldg4_relu_exp_small_nhwc_tn_v1 Tactic: 0x946eca69f99ddcb4 Time: 0.0398651
[11/18/2024-12:09:45] [V] [TRT] Tactic Name: volta_scudnn_128x64_sliced1x2_ldg4_relu_exp_medium_nhwc_tn_v1 Tactic: 0x852b455de4263ff7 Time: 0.0232921
[11/18/2024-12:09:45] [V] [TRT] Tactic Name: volta_scudnn_128x32_sliced1x4_ldg4_relu_exp_medium_nhwc_tn_v1 Tactic: 0xfa1e150a2da08265 Time: 0.0149865
[11/18/2024-12:09:45] [V] [TRT] Tactic Name: volta_scudnn_128x32_sliced1x4_ldg4_relu_exp_small_nhwc_tn_v1 Tactic: 0x516049bee7812ab0 Time: 0.0149449
[11/18/2024-12:09:45] [V] [TRT] Tactic Name: volta_scudnn_128x128_relu_exp_small_nhwc_tn_v1 Tactic: 0x50ca8db54378cbac Time: 0.0399851
[11/18/2024-12:09:45] [V] [TRT] Tactic Name: volta_scudnn_128x128_ldg4_relu_exp_interior_nhwc_tn_v1 Tactic: 0x849891f3d1d80c55 Time: 0.0399611
[11/18/2024-12:09:45] [V] [TRT] Tactic Name: volta_scudnn_128x128_relu_exp_medium_nhwc_tn_v1 Tactic: 0x0bf55a7b77a6ff98 Time: 0.0400823
[11/18/2024-12:09:45] [V] [TRT] Tactic Name: volta_scudnn_128x32_sliced1x4_ldg4_relu_exp_interior_nhwc_tn_v1 Tactic: 0x90d45931b538d74f Time: 0.0147003
[11/18/2024-12:09:45] [V] [TRT] Tactic Name: volta_scudnn_128x128_ldg4_relu_exp_medium_nhwc_tn_v1 Tactic: 0x810bd80d0531c0a0 Time: 0.0396594
[11/18/2024-12:09:45] [V] [TRT] /gnn/layers.0/attn/proj.1_1/Conv || /gnn/layers.0/attn/proj.0_1/Conv (CaskConvolution[0x80000009]) profiling completed in 0.0328482 seconds. Fastest Tactic: 0x90d45931b538d74f Time: 0.0147003
[11/18/2024-12:09:45] [V] [TRT] Skipping CaskGemmConvolution: No valid tactics for /gnn/layers.0/attn/proj.1_1/Conv || /gnn/layers.0/attn/proj.0_1/Conv
[11/18/2024-12:09:45] [V] [TRT] Skipping CaskFlattenConvolution: No valid tactics for /gnn/layers.0/attn/proj.1_1/Conv || /gnn/layers.0/attn/proj.0_1/Conv
[11/18/2024-12:09:45] [V] [TRT] >>>>>>>>>>>>>>> Chose Runner Type: CaskConvolution Tactic: 0x90d45931b538d74f
[11/18/2024-12:09:45] [V] [TRT] =============== Computing costs for shuffle_after_/gnn/layers.0/attn/proj.1_1/Conv_output
[11/18/2024-12:09:45] [V] [TRT] *************** Autotuning format combination: Float(1280,5,5,1) -> Float(1280,5,1,1) ***************
[11/18/2024-12:09:45] [V] [TRT] --------------- Timing Runner: shuffle_after_/gnn/layers.0/attn/proj.1_1/Conv_output (Shuffle[0x8000000d])
[11/18/2024-12:09:45] [V] [TRT] Tactic: 0x0000000000000000 Time: 0.00305945
[11/18/2024-12:09:45] [V] [TRT] Tactic: 0x0000000000000001 Time: 0.0209835
[11/18/2024-12:09:45] [V] [TRT] shuffle_after_/gnn/layers.0/attn/proj.1_1/Conv_output (Shuffle[0x8000000d]) profiling completed in 0.00332411 seconds. Fastest Tactic: 0x0000000000000000 Time: 0.00305945
[11/18/2024-12:09:45] [V] [TRT] >>>>>>>>>>>>>>> Chose Runner Type: Shuffle Tactic: 0x0000000000000000
[11/18/2024-12:09:45] [V] [TRT] *************** Autotuning format combination: Float(1280,5,5,1) -> Float(320,1:4,64,64) ***************
[11/18/2024-12:09:45] [V] [TRT] --------------- Timing Runner: shuffle_after_/gnn/layers.0/attn/proj.1_1/Conv_output (Shuffle[0x8000000d])
[11/18/2024-12:09:45] [V] [TRT] Tactic: 0x0000000000000000 Time: 0.00264626
[11/18/2024-12:09:45] [V] [TRT] shuffle_after_/gnn/layers.0/attn/proj.1_1/Conv_output (Shuffle[0x8000000d]) profiling completed in 0.00194697 seconds. Fastest Tactic: 0x0000000000000000 Time: 0.00264626
[11/18/2024-12:09:45] [V] [TRT] >>>>>>>>>>>>>>> Chose Runner Type: Shuffle Tactic: 0x0000000000000000
[11/18/2024-12:09:45] [V] [TRT] *************** Autotuning format combination: Float(1280,1,1280,256) -> Float(1280,1,256,256) ***************
[11/18/2024-12:09:45] [V] [TRT] --------------- Timing Runner: shuffle_after_/gnn/layers.0/attn/proj.1_1/Conv_output (Shuffle[0x8000000d])
[11/18/2024-12:09:45] [V] [TRT] Tactic: 0x0000000000000000 Time: 0.0025551
[11/18/2024-12:09:45] [V] [TRT] Tactic: 0x0000000000000001 Time: 0.0215713
[11/18/2024-12:09:45] [V] [TRT] shuffle_after_/gnn/layers.0/attn/proj.1_1/Conv_output (Shuffle[0x8000000d]) profiling completed in 0.00356228 seconds. Fastest Tactic: 0x0000000000000000 Time: 0.0025551
[11/18/2024-12:09:45] [V] [TRT] >>>>>>>>>>>>>>> Chose Runner Type: Shuffle Tactic: 0x0000000000000000
[11/18/2024-12:09:45] [V] [TRT] *************** Autotuning format combination: Float(320,1:4,320,64) -> Float(1280,5,1,1) ***************
[11/18/2024-12:09:45] [V] [TRT] --------------- Timing Runner: shuffle_after_/gnn/layers.0/attn/proj.1_1/Conv_output (Shuffle[0x8000000d])
[11/18/2024-12:09:45] [V] [TRT] Tactic: 0x0000000000000000 Time: 0.00257241
[11/18/2024-12:09:45] [V] [TRT] shuffle_after_/gnn/layers.0/attn/proj.1_1/Conv_output (Shuffle[0x8000000d]) profiling completed in 0.00199818 seconds. Fastest Tactic: 0x0000000000000000 Time: 0.00257241
[11/18/2024-12:09:45] [V] [TRT] >>>>>>>>>>>>>>> Chose Runner Type: Shuffle Tactic: 0x0000000000000000
[11/18/2024-12:09:45] [V] [TRT] *************** Autotuning format combination: Float(320,1:4,320,64) -> Float(320,1:4,64,64) ***************
[11/18/2024-12:09:45] [V] [TRT] --------------- Timing Runner: shuffle_after_/gnn/layers.0/attn/proj.1_1/Conv_output (Shuffle[0x8000000d])
[11/18/2024-12:09:45] [V] [TRT] Tactic: 0x0000000000000000 Time: 0.00291538
[11/18/2024-12:09:45] [V] [TRT] Tactic: 0x0000000000000001 Time: 0.0214485
[11/18/2024-12:09:45] [V] [TRT] shuffle_after_/gnn/layers.0/attn/proj.1_1/Conv_output (Shuffle[0x8000000d]) profiling completed in 0.00347477 seconds. Fastest Tactic: 0x0000000000000000 Time: 0.00291538
[11/18/2024-12:09:45] [V] [TRT] >>>>>>>>>>>>>>> Chose Runner Type: Shuffle Tactic: 0x0000000000000000
[11/18/2024-12:09:45] [V] [TRT] *************** Autotuning format combination: Float(40,5:32,5,1) -> Float(40,5:32,1,1) ***************
[11/18/2024-12:09:45] [V] [TRT] --------------- Timing Runner: shuffle_after_/gnn/layers.0/attn/proj.1_1/Conv_output (Shuffle[0x8000000d])
[11/18/2024-12:09:45] [V] [TRT] Tactic: 0x0000000000000000 Time: 0.00319035
[11/18/2024-12:09:45] [V] [TRT] Tactic: 0x0000000000000001 Time: 0.0213629
[11/18/2024-12:09:45] [V] [TRT] shuffle_after_/gnn/layers.0/attn/proj.1_1/Conv_output (Shuffle[0x8000000d]) profiling completed in 0.00336921 seconds. Fastest Tactic: 0x0000000000000000 Time: 0.00319035
[11/18/2024-12:09:45] [V] [TRT] >>>>>>>>>>>>>>> Chose Runner Type: Shuffle Tactic: 0x0000000000000000
[11/18/2024-12:09:45] [V] [TRT] =============== Computing costs for shuffle_after_/gnn/layers.0/attn/proj.0_1/Conv_output
[11/18/2024-12:09:45] [V] [TRT] shuffle_after_/gnn/layers.0/attn/proj.0_1/Conv_output [Float(1280,5,5,1) -> Float(1280,5,1,1)] got cached result: Shuffle, tactic 0x0000000000000000, 0 ms
[11/18/2024-12:09:45] [V] [TRT] shuffle_after_/gnn/layers.0/attn/proj.0_1/Conv_output [Float(1280,5,5,1) -> Float(320,1:4,64,64)] got cached result: Shuffle, tactic 0x0000000000000000, 0.00264626 ms
[11/18/2024-12:09:45] [V] [TRT] shuffle_after_/gnn/layers.0/attn/proj.0_1/Conv_output [Float(1280,1,1280,256) -> Float(1280,1,256,256)] got cached result: Shuffle, tactic 0x0000000000000000, 0 ms
[11/18/2024-12:09:45] [V] [TRT] shuffle_after_/gnn/layers.0/attn/proj.0_1/Conv_output [Float(320,1:4,320,64) -> Float(1280,5,1,1)] got cached result: Shuffle, tactic 0x0000000000000000, 0.00257241 ms
[11/18/2024-12:09:45] [V] [TRT] shuffle_after_/gnn/layers.0/attn/proj.0_1/Conv_output [Float(320,1:4,320,64) -> Float(320,1:4,64,64)] got cached result: Shuffle, tactic 0x0000000000000000, 0 ms
[11/18/2024-12:09:45] [V] [TRT] shuffle_after_/gnn/layers.0/attn/proj.0_1/Conv_output [Float(40,5:32,5,1) -> Float(40,5:32,1,1)] got cached result: Shuffle, tactic 0x0000000000000000, 0 ms
[11/18/2024-12:09:45] [V] [TRT] =============== Computing costs for shuffle_between_ONNXTRT_unsqueezeTensor_output_and_/gnn/layers.0/attn/proj.1/Conv
[11/18/2024-12:09:45] [V] [TRT] *************** Autotuning format combination: Float(25600,100,1,1) -> Float(25600,100,100,1) ***************
[11/18/2024-12:09:45] [V] [TRT] --------------- Timing Runner: shuffle_between_ONNXTRT_unsqueezeTensor_output_and_/gnn/layers.0/attn/proj.1/Conv (Shuffle[0x8000000d])
[11/18/2024-12:09:45] [V] [TRT] Tactic: 0x0000000000000000 Time: 0.0030437
[11/18/2024-12:09:45] [V] [TRT] Tactic: 0x0000000000000001 Time: 0.0217757
[11/18/2024-12:09:45] [V] [TRT] shuffle_between_ONNXTRT_unsqueezeTensor_output_and_/gnn/layers.0/attn/proj.1/Conv (Shuffle[0x8000000d]) profiling completed in 0.00334388 seconds. Fastest Tactic: 0x0000000000000000 Time: 0.0030437
[11/18/2024-12:09:45] [V] [TRT] >>>>>>>>>>>>>>> Chose Runner Type: Shuffle Tactic: 0x0000000000000000
[11/18/2024-12:09:45] [V] [TRT] *************** Autotuning format combination: Float(25600,100,1,1) -> Float(6400,1:4,6400,64) ***************
[11/18/2024-12:09:45] [V] [TRT] --------------- Timing Runner: shuffle_between_ONNXTRT_unsqueezeTensor_output_and_/gnn/layers.0/attn/proj.1/Conv (Shuffle[0x8000000d])
[11/18/2024-12:09:45] [V] [TRT] Tactic: 0x0000000000000000 Time: 0.00340898
[11/18/2024-12:09:45] [V] [TRT] shuffle_between_ONNXTRT_unsqueezeTensor_output_and_/gnn/layers.0/attn/proj.1/Conv (Shuffle[0x8000000d]) profiling completed in 0.00225464 seconds. Fastest Tactic: 0x0000000000000000 Time: 0.00340898
[11/18/2024-12:09:45] [V] [TRT] >>>>>>>>>>>>>>> Chose Runner Type: Shuffle Tactic: 0x0000000000000000
[11/18/2024-12:09:45] [V] [TRT] *************** Autotuning format combination: Float(25600,1,256,256) -> Float(25600,1,25600,256) ***************
[11/18/2024-12:09:45] [V] [TRT] --------------- Timing Runner: shuffle_between_ONNXTRT_unsqueezeTensor_output_and_/gnn/layers.0/attn/proj.1/Conv (Shuffle[0x8000000d])
[11/18/2024-12:09:45] [V] [TRT] Tactic: 0x0000000000000000 Time: 0.0026803
[11/18/2024-12:09:45] [V] [TRT] Tactic: 0x0000000000000001 Time: 0.0208366
[11/18/2024-12:09:45] [V] [TRT] shuffle_between_ONNXTRT_unsqueezeTensor_output_and_/gnn/layers.0/attn/proj.1/Conv (Shuffle[0x8000000d]) profiling completed in 0.00385309 seconds. Fastest Tactic: 0x0000000000000000 Time: 0.0026803
[11/18/2024-12:09:45] [V] [TRT] >>>>>>>>>>>>>>> Chose Runner Type: Shuffle Tactic: 0x0000000000000000
[11/18/2024-12:09:45] [V] [TRT] *************** Autotuning format combination: Float(6400,1:4,64,64) -> Float(25600,100,100,1) ***************
[11/18/2024-12:09:45] [V] [TRT] --------------- Timing Runner: shuffle_between_ONNXTRT_unsqueezeTensor_output_and_/gnn/layers.0/attn/proj.1/Conv (Shuffle[0x8000000d])
[11/18/2024-12:09:45] [V] [TRT] Tactic: 0x0000000000000000 Time: 0.00384337
[11/18/2024-12:09:45] [V] [TRT] shuffle_between_ONNXTRT_unsqueezeTensor_output_and_/gnn/layers.0/attn/proj.1/Conv (Shuffle[0x8000000d]) profiling completed in 0.00219075 seconds. Fastest Tactic: 0x0000000000000000 Time: 0.00384337
[11/18/2024-12:09:45] [V] [TRT] >>>>>>>>>>>>>>> Chose Runner Type: Shuffle Tactic: 0x0000000000000000
[11/18/2024-12:09:45] [V] [TRT] *************** Autotuning format combination: Float(6400,1:4,64,64) -> Float(6400,1:4,6400,64) ***************
[11/18/2024-12:09:45] [V] [TRT] --------------- Timing Runner: shuffle_between_ONNXTRT_unsqueezeTensor_output_and_/gnn/layers.0/attn/proj.1/Conv (Shuffle[0x8000000d])
[11/18/2024-12:09:45] [V] [TRT] Tactic: 0x0000000000000000 Time: 0.00283662
[11/18/2024-12:09:45] [V] [TRT] Tactic: 0x0000000000000001 Time: 0.0209855
[11/18/2024-12:09:45] [V] [TRT] shuffle_between_ONNXTRT_unsqueezeTensor_output_and_/gnn/layers.0/attn/proj.1/Conv (Shuffle[0x8000000d]) profiling completed in 0.00360549 seconds. Fastest Tactic: 0x0000000000000000 Time: 0.00283662
[11/18/2024-12:09:45] [V] [TRT] >>>>>>>>>>>>>>> Chose Runner Type: Shuffle Tactic: 0x0000000000000000
[11/18/2024-12:09:45] [V] [TRT] *************** Autotuning format combination: Float(800,100:32,1,1) -> Float(800,100:32,100,1) ***************
[11/18/2024-12:09:45] [V] [TRT] --------------- Timing Runner: shuffle_between_ONNXTRT_unsqueezeTensor_output_and_/gnn/layers.0/attn/proj.1/Conv (Shuffle[0x8000000d])
[11/18/2024-12:09:45] [V] [TRT] Tactic: 0x0000000000000000 Time: 0.00309777
[11/18/2024-12:09:45] [V] [TRT] Tactic: 0x0000000000000001 Time: 0.0216516
[11/18/2024-12:09:45] [V] [TRT] shuffle_between_ONNXTRT_unsqueezeTensor_output_and_/gnn/layers.0/attn/proj.1/Conv (Shuffle[0x8000000d]) profiling completed in 0.00361109 seconds. Fastest Tactic: 0x0000000000000000 Time: 0.00309777
[11/18/2024-12:09:45] [V] [TRT] >>>>>>>>>>>>>>> Chose Runner Type: Shuffle Tactic: 0x0000000000000000
[11/18/2024-12:09:45] [V] [TRT] =============== Computing costs for /gnn/layers.0/attn/proj.1/Conv || /gnn/layers.0/attn/proj.0/Conv
[11/18/2024-12:09:45] [V] [TRT] *************** Autotuning format combination: Float(25600,100,100,1) -> Float(51200,100,100,1) ***************
[11/18/2024-12:09:45] [V] [TRT] --------------- Timing Runner: /gnn/layers.0/attn/proj.1/Conv || /gnn/layers.0/attn/proj.0/Conv (CaskConvolution[0x80000009])
[11/18/2024-12:09:45] [V] [TRT] Tactic Name: volta_scudnn_128x64_relu_medium_nn_v1 Tactic: 0x90238daf8750ddb0 Time: 0.0277242
[11/18/2024-12:09:45] [V] [TRT] Tactic Name: volta_scudnn_128x128_relu_medium_nn_v1 Tactic: 0x195431d38ba5af88 Time: 0.041656
[11/18/2024-12:09:45] [V] [TRT] Tactic Name: volta_scudnn_128x128_relu_small_nn_v1 Tactic: 0x365602d0613d4c36 Time: 0.0410503
[11/18/2024-12:09:45] [V] [TRT] Tactic Name: volta_scudnn_128x32_relu_small_nn_v1 Tactic: 0xc939b7b0a4d5a05f Time: 0.030613
[11/18/2024-12:09:46] [V] [TRT] Tactic Name: volta_scudnn_128x32_relu_medium_nn_v1 Tactic: 0xc2a5fc6b5e7cef5e Time: 0.0239368
[11/18/2024-12:09:46] [V] [TRT] Tactic Name: volta_scudnn_128x128_relu_interior_nn_v1 Tactic: 0x18597bd4a7d0164d Time: 0.0410229
[11/18/2024-12:09:46] [V] [TRT] Tactic Name: sm50_xmma_conv_fprop_fused_conv_act_fp32_NCHW_fp32_NCHW_KCRS_fp32_fp32_fp32_Accfloat_1_1_cC1_dC1_srcVec2_fltVec1_1_TP3_TQ10_C1_R1_S1_U1_V1 Tactic: 0x053bede31607189f Time: 0.0642179
[11/18/2024-12:09:46] [V] [TRT] Tactic Name: sm50_xmma_conv_fprop_fused_conv_act_fp32_NCHW_fp32_NCHW_KCRS_fp32_fp32_fp32_Accfloat_1_1_cC1_dC1_srcVec1_fltVec4_4_TP6_TQ5_C4_R1_S1_U1_V1 Tactic: 0x3652da2fa8bb0ef3 Time: 0.063104
[11/18/2024-12:09:46] [V] [TRT] Tactic Name: sm50_xmma_conv_fprop_fused_conv_act_fp32_NCHW_fp32_NCHW_KCRS_fp32_fp32_fp32_Accfloat_1_1_cC1_dC1_srcVec4_fltVec1_1_TP7_TQ4_C8_R1_S1_U1_V1 Tactic: 0x79164861aa018d25 Time: 0.132791
[11/18/2024-12:09:46] [V] [TRT] Tactic Name: sm50_xmma_conv_fprop_fused_conv_act_fp32_NCHW_fp32_NCHW_KCRS_fp32_fp32_fp32_Accfloat_1_1_cC1_dC1_srcVec4_fltVec1_1_TP7_TQ2_C2_R1_S1_U1_V1 Tactic: 0x001526e231ae2e51 Time: 0.148919
[11/18/2024-12:09:46] [V] [TRT] Tactic Name: sm50_xmma_conv_fprop_fused_conv_act_fp32_NCHW_fp32_NCHW_KCRS_fp32_fp32_fp32_Accfloat_1_1_cC1_dC1_srcVec4_fltVec1_1_TP2_TQ7_C1_R1_S1_U1_V1 Tactic: 0xdfbf20bf5c5ed39e Time: 0.049917
[11/18/2024-12:09:46] [V] [TRT] Tactic Name: sm50_xmma_conv_fprop_fused_conv_act_fp32_NCHW_fp32_NCHW_KCRS_fp32_fp32_fp32_Accfloat_1_1_cC1_dC1_srcVec4_fltVec1_1_TP4_TQ8_C8_R1_S1_U1_V1 Tactic: 0xadc24b6dce6a94cc Time: 0.0797554
[11/18/2024-12:09:46] [V] [TRT] Tactic Name: sm50_xmma_conv_fprop_fused_conv_act_fp32_NCHW_fp32_NCHW_KCRS_fp32_fp32_fp32_Accfloat_1_1_cC1_dC1_srcVec2_fltVec2_2_TP7_TQ4_C4_R1_S1_U1_V1 Tactic: 0x361add5e7e5ba900 Time: 0.077456
[11/18/2024-12:09:46] [V] [TRT] Tactic Name: sm50_xmma_conv_fprop_fused_conv_act_fp32_NCHW_fp32_NCHW_KCRS_fp32_fp32_fp32_Accfloat_1_1_cC1_dC1_srcVec2_fltVec2_2_TP4_TQ4_C1_R1_S1_U1_V1 Tactic: 0x13e300b312a555d1 Time: 0.0641585
[11/18/2024-12:09:46] [V] [TRT] Tactic Name: sm50_xmma_conv_fprop_fused_conv_act_fp32_NCHW_fp32_NCHW_KCRS_fp32_fp32_fp32_Accfloat_1_1_cC1_dC1_srcVec1_fltVec4_4_TP1_TQ10_C2_R1_S1_U1_V1 Tactic: 0x9140485476980e7c Time: 0.0344878
[11/18/2024-12:09:46] [V] [TRT] Tactic Name: sm50_xmma_conv_fprop_fused_conv_act_fp32_NCHW_fp32_NCHW_KCRS_fp32_fp32_fp32_Accfloat_1_1_cC1_dC1_srcVec2_fltVec2_2_TP7_TQ2_C2_R1_S1_U1_V1 Tactic: 0xba220b2881c61eb6 Time: 0.0878789
[11/18/2024-12:09:46] [V] [TRT] Tactic Name: sm50_xmma_conv_fprop_fused_conv_act_fp32_NCHW_fp32_NCHW_KCRS_fp32_fp32_fp32_Accfloat_1_1_cC1_dC1_srcVec4_fltVec1_1_TP8_TQ2_C2_R1_S1_U1_V1 Tactic: 0xb1208f5cd1618214 Time: 0.163031
[11/18/2024-12:09:46] [V] [TRT] Tactic Name: sm70_xmma_fprop_implicit_gemm_f32f32_f32f32_f32_nchwkcrs_nchw_tilesize128x16x8_stage1_warpsize4x1x1_g1_ffma_aligna4_alignc4 Tactic: 0x160b77f4a95ab6d3 Time: 0.0247581
[11/18/2024-12:09:46] [V] [TRT] Tactic Name: sm50_xmma_conv_fprop_fused_conv_act_fp32_NCHW_fp32_NCHW_KCRS_fp32_fp32_fp32_Accfloat_1_1_cC1_dC1_srcVec2_fltVec2_2_TP2_TQ7_C4_R1_S1_U1_V1 Tactic: 0xeb3768a7d0a4636a Time: 0.0335369
[11/18/2024-12:09:46] [V] [TRT] Tactic Name: sm50_xmma_conv_fprop_fused_conv_act_fp32_NCHW_fp32_NCHW_KCRS_fp32_fp32_fp32_Accfloat_1_1_cC1_dC1_srcVec2_fltVec1_1_TP3_TQ10_C4_R1_S1_U1_V1 Tactic: 0x8b8488312a95988c Time: 0.0578438
[11/18/2024-12:09:46] [V] [TRT] Tactic Name: sm50_xmma_conv_fprop_fused_conv_act_fp32_NCHW_fp32_NCHW_KCRS_fp32_fp32_fp32_Accfloat_1_1_cC1_dC1_srcVec1_fltVec4_4_TP3_TQ8_C2_R1_S1_U1_V1 Tactic: 0xbc130e9bbb26c09e Time: 0.0457989
[11/18/2024-12:09:46] [V] [TRT] Tactic Name: sm50_xmma_conv_fprop_fused_conv_act_fp32_NCHW_fp32_NCHW_KCRS_fp32_fp32_fp32_Accfloat_1_1_cC1_dC1_srcVec4_fltVec1_1_TP7_TQ1_C1_R1_S1_U1_V1 Tactic: 0x46094dd94e60f58a Time: 0.187538
[11/18/2024-12:09:46] [V] [TRT] Tactic Name: sm50_xmma_conv_fprop_fused_conv_act_fp32_NCHW_fp32_NCHW_KCRS_fp32_fp32_fp32_Accfloat_1_1_cC1_dC1_srcVec4_fltVec1_1_TP4_TQ4_C2_R1_S1_U1_V1 Tactic: 0x5df694d12c46ef44 Time: 0.0847429
[11/18/2024-12:09:46] [V] [TRT] Tactic Name: sm50_xmma_conv_fprop_fused_conv_act_fp32_NCHW_fp32_NCHW_KCRS_fp32_fp32_fp32_Accfloat_1_1_cC1_dC1_srcVec4_fltVec1_1_TP4_TQ7_C4_R1_S1_U1_V1 Tactic: 0x95559a386f1ab48c Time: 0.0787794
[11/18/2024-12:09:46] [V] [TRT] Tactic Name: sm50_xmma_conv_fprop_fused_conv_act_fp32_NCHW_fp32_NCHW_KCRS_fp32_fp32_fp32_Accfloat_1_1_cC1_dC1_srcVec2_fltVec2_2_TP8_TQ2_C8_R1_S1_U1_V1 Tactic: 0x84b1c619b722ac50 Time: 0.103563
[11/18/2024-12:09:46] [V] [TRT] Tactic Name: sm50_xmma_conv_fprop_fused_conv_act_fp32_NCHW_fp32_NCHW_KCRS_fp32_fp32_fp32_Accfloat_1_1_cC1_dC1_srcVec1_fltVec4_4_TP4_TQ5_C8_R1_S1_U1_V1 Tactic: 0x80a5d7e9c9c4b8ce Time: 0.050243
[11/18/2024-12:09:46] [V] [TRT] Tactic Name: sm50_xmma_conv_fprop_fused_conv_act_fp32_NCHW_fp32_NCHW_KCRS_fp32_fp32_fp32_Accfloat_1_1_cC1_dC1_srcVec2_fltVec2_2_TP2_TQ8_C4_R1_S1_U1_V1 Tactic: 0x269b010715e657e8 Time: 0.0312622
[11/18/2024-12:09:46] [V] [TRT] Tactic Name: sm50_xmma_conv_fprop_fused_conv_act_fp32_NCHW_fp32_NCHW_KCRS_fp32_fp32_fp32_Accfloat_1_1_cC1_dC1_srcVec4_fltVec1_1_TP4_TQ8_C1_R1_S1_U1_V1 Tactic: 0xd646964a96ca001d Time: 0.0848091
[11/18/2024-12:09:46] [V] [TRT] Tactic Name: sm50_xmma_conv_fprop_fused_conv_act_fp32_NCHW_fp32_NCHW_KCRS_fp32_fp32_fp32_Accfloat_1_1_cC1_dC1_srcVec4_fltVec1_1_TP4_TQ7_C8_R1_S1_U1_V1 Tactic: 0x606e22cd0b28a04e Time: 0.0822377
[11/18/2024-12:09:46] [V] [TRT] Tactic Name: sm50_xmma_conv_fprop_fused_conv_act_fp32_NCHW_fp32_NCHW_KCRS_fp32_fp32_fp32_Accfloat_1_1_cC1_dC1_srcVec2_fltVec2_2_TP3_TQ10_C8_R1_S1_U1_V1 Tactic: 0x06122dede8a04ac8 Time: 0.0398263
[11/18/2024-12:09:46] [V] [TRT] Tactic Name: sm50_xmma_conv_fprop_fused_conv_act_fp32_NCHW_fp32_NCHW_KCRS_fp32_fp32_fp32_Accfloat_1_1_cC1_dC1_srcVec4_fltVec1_1_TP5_TQ5_C2_R1_S1_U1_V1 Tactic: 0x55214d4ab35e0b9d Time: 0.0935223
[11/18/2024-12:09:46] [V] [TRT] Tactic Name: sm50_xmma_conv_fprop_fused_conv_act_fp32_NCHW_fp32_NCHW_KCRS_fp32_fp32_fp32_Accfloat_1_1_cC1_dC1_srcVec2_fltVec2_2_TP2_TQ7_C2_R1_S1_U1_V1 Tactic: 0x91aab4dd62bd690b Time: 0.0339045
[11/18/2024-12:09:46] [V] [TRT] Tactic Name: sm50_xmma_conv_fprop_fused_conv_act_fp32_NCHW_fp32_NCHW_KCRS_fp32_fp32_fp32_Accfloat_1_1_cC1_dC1_srcVec4_fltVec1_1_TP7_TQ4_C4_R1_S1_U1_V1 Tactic: 0x8c2df094ce3399e7 Time: 0.126862
